22:11:35.245413 IP 192.30.253.125.https > 192.168.1.10.49740: Flags [.], ack 3232198075, win 31, options [nop,nop,TS val 1460223892 ecr 6277091], length 0
22:11:36.116998 IP6 fe80::a959:335:80f7:f6c0.37397 > fe80::1.domain: 36700+ PTR? 10.1.168.192.in-addr.arpa. (43)
22:11:36.170642 IP6 fe80::1.domain > fe80::a959:335:80f7:f6c0.37397: 36700 NXDomain* 0/1/0 (102)
22:11:36.171425 IP6 fe80::a959:335:80f7:f6c0.34882 > fe80::1.domain: 20244+ PTR? 125.253.30.192.in-addr.arpa. (45)
22:11:36.291546 IP6 fe80::1.domain > fe80::a959:335:80f7:f6c0.34882: 20244 NXDomain 0/1/0 (113)
22:11:37.045436 IP 192.168.1.10.58235 > 103.28.94.245.https: UDP, length 24
22:11:37.106122 IP 103.28.94.245.https > 192.168.1.10.58235: UDP, length 46
22:11:37.116202 IP6 fe80::a959:335:80f7:f6c0.58044 > fe80::1.domain: 65201+ PTR? 1.0.0.0.0.0.0.0.0.0.0.0.0.0.0.0.0.0.0.0.0.0.0.0.0.0.0.0.0.8.e.f.ip6.arpa. (90)
22:11:37.117475 IP6 fe80::1.domain > fe80::a959:335:80f7:f6c0.58044: 65201 NXDomain 0/0/0 (90)
22:11:37.118101 IP6 fe80::a959:335:80f7:f6c0.37093 > fe80::1.domain: 65315+ PTR? 0.c.6.f.7.f.0.8.5.3.3.0.9.5.9.a.0.0.0.0.0.0.0.0.0.0.0.0.0.8.e.f.ip6.arpa. (90)
22:11:37.119222 IP6 fe80::1.domain > fe80::a959:335:80f7:f6c0.37093: 65315 NXDomain 0/0/0 (90)
22:11:37.120163 IP6 fe80::a959:335:80f7:f6c0.21286 > fe80::1.domain: 49356+ PTR? 245.94.28.103.in-addr.arpa. (44)
22:11:37.163398 IP6 fe80::1.domain > fe80::a959:335:80f7:f6c0.21286: 49356 NXDomain 0/1/0 (133)
22:11:37.614666 IP6 fe80::a959:335:80f7:f6c0.63136 > fe80::1.domain: 20921+ A? clients4.google.com. (37)
22:11:37.619651 IP6 fe80::1.domain > fe80::a959:335:80f7:f6c0.63136: 20921 16/0/0 CNAME clients.l.google.com., A 103.28.94.215, A 103.28.94.230, A 103.28.94.211, A 103.28.94.207, A 103.28.94.249, A 103.28.94.236, A 103.28.94.251, A 103.28.94.245, A 103.28.94.226, A 103.28.94.221, A 103.28.94.222, A 103.28.94.241, A 103.28.94.237, A 103.28.94.219, A 103.28.94.234 (311)
22:11:37.620322 IP 192.168.1.10.43012 > 103.28.94.215.https: Flags [S], seq 427378173, win 29200, options [mss 1460,sackOK,TS val 6277757 ecr 0,nop,wscale 7], length 0
22:11:37.627285 IP 103.28.94.215.https > 192.168.1.10.43012: Flags [S.], seq 955476732, ack 427378174, win 28960, options [mss 1412,sackOK,TS val 1803322574 ecr 6277757,nop,wscale 7], length 0
22:11:37.627342 IP 192.168.1.10.43012 > 103.28.94.215.https: Flags [.], ack 1, win 229, options [nop,nop,TS val 6277758 ecr 1803322574], length 0
22:11:37.627728 IP 192.168.1.10.43012 > 103.28.94.215.https: Flags [P.], seq 1:201, ack 1, win 229, options [nop,nop,TS val 6277759 ecr 1803322574], length 200
22:11:37.635357 IP 103.28.94.215.https > 192.168.1.10.43012: Flags [.], ack 201, win 235, options [nop,nop,TS val 1803322581 ecr 6277759], length 0
22:11:37.655817 IP 103.28.94.215.https > 192.168.1.10.43012: Flags [.], seq 1:1401, ack 201, win 235, options [nop,nop,TS val 1803322600 ecr 6277759], length 1400
22:11:37.655867 IP 192.168.1.10.43012 > 103.28.94.215.https: Flags [.], ack 1401, win 250, options [nop,nop,TS val 6277766 ecr 1803322600], length 0
22:11:37.656652 IP 103.28.94.215.https > 192.168.1.10.43012: Flags [P.], seq 1401:2049, ack 201, win 235, options [nop,nop,TS val 1803322600 ecr 6277759], length 648
22:11:37.656672 IP 192.168.1.10.43012 > 103.28.94.215.https: Flags [.], ack 2049, win 272, options [nop,nop,TS val 6277766 ecr 1803322600], length 0
22:11:37.656698 IP 103.28.94.215.https > 192.168.1.10.43012: Flags [.], seq 2049:3449, ack 201, win 235, options [nop,nop,TS val 1803322600 ecr 6277759], length 1400
22:11:37.656710 IP 192.168.1.10.43012 > 103.28.94.215.https: Flags [.], ack 3449, win 294, options [nop,nop,TS val 6277766 ecr 1803322600], length 0
22:11:37.656724 IP 103.28.94.215.https > 192.168.1.10.43012: Flags [P.], seq 3449:4097, ack 201, win 235, options [nop,nop,TS val 1803322600 ecr 6277759], length 648
22:11:37.656733 IP 192.168.1.10.43012 > 103.28.94.215.https: Flags [.], ack 4097, win 316, options [nop,nop,TS val 6277766 ecr 1803322600], length 0
22:11:37.656744 IP 103.28.94.215.https > 192.168.1.10.43012: Flags [P.], seq 4097:4204, ack 201, win 235, options [nop,nop,TS val 1803322600 ecr 6277759], length 107
22:11:37.656754 IP 192.168.1.10.43012 > 103.28.94.215.https: Flags [.], ack 4204, win 316, options [nop,nop,TS val 6277766 ecr 1803322600], length 0
22:11:37.664607 IP 192.168.1.10.43012 > 103.28.94.215.https: Flags [P.], seq 201:459, ack 4204, win 316, options [nop,nop,TS val 6277768 ecr 1803322600], length 258
22:11:37.670922 IP 192.168.1.10.43012 > 103.28.94.215.https: Flags [P.], seq 459:512, ack 4204, win 316, options [nop,nop,TS val 6277769 ecr 1803322600], length 53
22:11:37.671421 IP 192.168.1.10.43012 > 103.28.94.215.https: Flags [.], seq 512:1912, ack 4204, win 316, options [nop,nop,TS val 6277769 ecr 1803322600], length 1400
22:11:37.673792 IP 192.168.1.10.43012 > 103.28.94.215.https: Flags [P.], seq 1912:2957, ack 4204, win 316, options [nop,nop,TS val 6277770 ecr 1803322600], length 1045
22:11:37.683297 IP 103.28.94.215.https > 192.168.1.10.43012: Flags [.], ack 512, win 243, options [nop,nop,TS val 1803322624 ecr 6277768], length 0
22:11:37.685656 IP 103.28.94.215.https > 192.168.1.10.43012: Flags [.], ack 2957, win 288, options [nop,nop,TS val 1803322627 ecr 6277769], length 0
22:11:37.691250 IP sa-in-f189.1e100.net.https > 192.168.1.10.43986: Flags [P.], seq 842757570:842757631, ack 154613081, win 556, options [nop,nop,TS val 287259631 ecr 6270664], length 61
22:11:37.691300 IP 192.168.1.10.43986 > sa-in-f189.1e100.net.https: Flags [.], ack 61, win 600, options [nop,nop,TS val 6277774 ecr 287259631], length 0
22:11:37.693329 IP 103.28.94.215.https > 192.168.1.10.43012: Flags [P.], seq 4204:4602, ack 2957, win 288, options [nop,nop,TS val 1803322636 ecr 6277769], length 398
22:11:37.693619 IP 192.168.1.10.43012 > 103.28.94.215.https: Flags [P.], seq 2957:2995, ack 4602, win 338, options [nop,nop,TS val 6277775 ecr 1803322636], length 38
22:11:37.701061 IP 103.28.94.215.https > 192.168.1.10.43012: Flags [P.], seq 4602:4640, ack 2957, win 288, options [nop,nop,TS val 1803322642 ecr 6277769], length 38
22:11:37.739602 IP 192.168.1.10.43012 > 103.28.94.215.https: Flags [.], ack 4640, win 338, options [nop,nop,TS val 6277787 ecr 1803322642], length 0
22:11:37.743952 IP 103.28.94.215.https > 192.168.1.10.43012: Flags [.], ack 2995, win 288, options [nop,nop,TS val 1803322687 ecr 6277775], length 0
22:11:37.755615 IP 103.28.94.215.https > 192.168.1.10.43012: Flags [P.], seq 4640:4835, ack 2995, win 288, options [nop,nop,TS val 1803322698 ecr 6277787], length 195
22:11:37.755663 IP 192.168.1.10.43012 > 103.28.94.215.https: Flags [.], ack 4835, win 360, options [nop,nop,TS val 6277791 ecr 1803322698], length 0
22:11:37.756597 IP 192.168.1.10.43012 > 103.28.94.215.https: Flags [P.], seq 2995:3041, ack 4835, win 360, options [nop,nop,TS val 6277791 ecr 1803322698], length 46
22:11:37.767953 IP 103.28.94.215.https > 192.168.1.10.43012: Flags [.], ack 3041, win 288, options [nop,nop,TS val 1803322710 ecr 6277791], length 0
22:11:38.116338 IP6 fe80::a959:335:80f7:f6c0.11779 > fe80::1.domain: 10971+ PTR? 215.94.28.103.in-addr.arpa. (44)
22:11:38.164894 IP6 fe80::1.domain > fe80::a959:335:80f7:f6c0.11779: 10971 NXDomain 0/1/0 (133)
22:11:38.166179 IP6 fe80::a959:335:80f7:f6c0.54116 > fe80::1.domain: 40876+ PTR? 189.200.125.74.in-addr.arpa. (45)
22:11:38.208958 IP6 fe80::1.domain > fe80::a959:335:80f7:f6c0.54116: 40876 1/0/0 PTR sa-in-f189.1e100.net. (79)
22:11:38.527623 IP 192.168.1.10.44944 > 151.101.100.133.https: Flags [.], ack 640951052, win 469, options [nop,nop,TS val 6277984 ecr 2654379198], length 0
22:11:38.548761 IP 151.101.100.133.https > 192.168.1.10.44944: Flags [.], ack 1, win 62, options [nop,nop,TS val 2654390463 ecr 6266724], length 0
22:11:39.116270 IP6 fe80::a959:335:80f7:f6c0.37267 > fe80::1.domain: 26457+ PTR? 133.100.101.151.in-addr.arpa. (46)
22:11:39.117684 IP6 fe80::1.domain > fe80::a959:335:80f7:f6c0.37267: 26457 NXDomain 0/0/0 (46)
22:11:40.575582 IP 192.168.1.10.40012 > sc-in-f188.1e100.net.5228: Flags [.], ack 419542379, win 338, options [nop,nop,TS val 6278496 ecr 577349650], length 0
22:11:40.598223 IP sc-in-f188.1e100.net.5228 > 192.168.1.10.40012: Flags [.], ack 1, win 357, options [nop,nop,TS val 577394705 ecr 6255971], length 0
22:11:41.116154 IP6 fe80::a959:335:80f7:f6c0.18903 > fe80::1.domain: 620+ PTR? 188.68.125.74.in-addr.arpa. (44)
22:11:41.127978 IP6 fe80::1.domain > fe80::a959:335:80f7:f6c0.18903: 620 1/0/0 PTR sc-in-f188.1e100.net. (78)
22:11:41.303634 IP 64.4.45.13.https > 192.168.1.10.50184: Flags [P.], seq 3729469345:3729469878, ack 1878061340, win 607, options [nop,nop,TS val 3485965193 ecr 6269252], length 533
22:11:41.303708 IP 192.168.1.10.50184 > 64.4.45.13.https: Flags [.], ack 533, win 1318, options [nop,nop,TS val 6278678 ecr 3485965193], length 0
22:11:41.919562 IP 192.168.1.10.46756 > 192.30.253.117.https: Flags [.], ack 4047489200, win 286, options [nop,nop,TS val 6278832 ecr 2068093993], length 0
22:11:42.105816 ARP, Request who-has 192.168.1.10 tell 192.168.1.1, length 28
22:11:42.105849 ARP, Reply 192.168.1.10 is-at 08:11:96:a5:65:78 (oui Unknown), length 28
22:11:42.115925 IP6 fe80::a959:335:80f7:f6c0.49942 > fe80::1.domain: 61836+ PTR? 13.45.4.64.in-addr.arpa. (41)
22:11:42.115978 IP 192.168.1.10.17927 > 192.168.1.1.domain: 61836+ PTR? 13.45.4.64.in-addr.arpa. (41)
22:11:42.119307 IP6 fe80::1.domain > fe80::a959:335:80f7:f6c0.49942: 61836 NXDomain 0/0/0 (41)
22:11:42.119855 IP6 fe80::a959:335:80f7:f6c0.11205 > fe80::1.domain: 60135+ PTR? 117.253.30.192.in-addr.arpa. (45)
22:11:42.126360 IP 192.168.1.1.domain > 192.168.1.10.17927: 61836 NXDomain 0/1/0 (109)
22:11:42.126413 IP 192.168.1.10 > 192.168.1.1: ICMP 192.168.1.10 udp port 17927 unreachable, length 145
22:11:42.150466 IP6 fe80::1.domain > fe80::a959:335:80f7:f6c0.11205: 60135 NXDomain 0/1/0 (113)
22:11:42.151064 IP6 fe80::a959:335:80f7:f6c0.44436 > fe80::1.domain: 7354+ PTR? 1.1.168.192.in-addr.arpa. (42)
22:11:42.162213 IP6 fe80::1.domain > fe80::a959:335:80f7:f6c0.44436: 7354 NXDomain* 0/1/0 (101)
22:11:42.193543 IP 192.30.253.117.https > 192.168.1.10.46756: Flags [.], ack 1, win 114, options [nop,nop,TS val 2068105322 ecr 6267588], length 0
22:11:44.599312 IP 192.168.1.10.44738 > b2.e0.559e.ip4.static.sl-reverse.com.https: Flags [P.], seq 1706093384:1706093422, ack 1575984225, win 2553, options [nop,nop,TS val 6279501 ecr 2819526985], length 38
22:11:44.864780 IP b2.e0.559e.ip4.static.sl-reverse.com.https > 192.168.1.10.44738: Flags [P.], seq 1:46, ack 38, win 5, options [nop,nop,TS val 2819538107 ecr 6279501], length 45
22:11:44.864843 IP 192.168.1.10.44738 > b2.e0.559e.ip4.static.sl-reverse.com.https: Flags [.], ack 46, win 2553, options [nop,nop,TS val 6279568 ecr 2819538107], length 0
22:11:45.116209 IP6 fe80::a959:335:80f7:f6c0.14361 > fe80::1.domain: 63257+ PTR? 178.224.85.158.in-addr.arpa. (45)
22:11:45.117623 IP6 fe80::1.domain > fe80::a959:335:80f7:f6c0.14361: 63257 1/0/0 PTR b2.e0.559e.ip4.static.sl-reverse.com. (95)
22:11:45.618764 IP6 fe80::a959:335:80f7:f6c0.4269 > fe80::1.domain: 32189+ A? plus.google.com. (33)
22:11:45.666393 IP6 fe80::1.domain > fe80::a959:335:80f7:f6c0.4269: 32189 15/0/0 A 103.28.94.226, A 103.28.94.245, A 103.28.94.241, A 103.28.94.215, A 103.28.94.230, A 103.28.94.211, A 103.28.94.236, A 103.28.94.251, A 103.28.94.219, A 103.28.94.237, A 103.28.94.234, A 103.28.94.249, A 103.28.94.222, A 103.28.94.221, A 103.28.94.207 (273)
22:11:45.668042 IP 192.168.1.10.43012 > 103.28.94.215.https: Flags [P.], seq 3041:3340, ack 4835, win 360, options [nop,nop,TS val 6279769 ecr 1803322710], length 299
22:11:45.670972 IP 192.168.1.10.43012 > 103.28.94.215.https: Flags [P.], seq 3340:3547, ack 4835, win 360, options [nop,nop,TS val 6279769 ecr 1803322710], length 207
22:11:45.681233 IP 103.28.94.215.https > 192.168.1.10.43012: Flags [.], ack 3340, win 310, options [nop,nop,TS val 1803330621 ecr 6279769], length 0
22:11:45.685163 IP 103.28.94.215.https > 192.168.1.10.43012: Flags [.], ack 3547, win 332, options [nop,nop,TS val 1803330625 ecr 6279769], length 0
22:11:45.889219 IP 103.28.94.215.https > 192.168.1.10.43012: Flags [P.], seq 4835:5469, ack 3547, win 332, options [nop,nop,TS val 1803330832 ecr 6279769], length 634
22:11:45.927600 IP 192.168.1.10.43012 > 103.28.94.215.https: Flags [.], ack 5469, win 382, options [nop,nop,TS val 6279834 ecr 1803330832], length 0
22:11:46.065770 IP 103.28.94.215.https > 192.168.1.10.43012: Flags [P.], seq 5469:5951, ack 3547, win 332, options [nop,nop,TS val 1803331009 ecr 6279834], length 482
22:11:46.065833 IP 192.168.1.10.43012 > 103.28.94.215.https: Flags [.], ack 5951, win 404, options [nop,nop,TS val 6279868 ecr 1803331009], length 0
22:11:46.066531 IP 192.168.1.10.43012 > 103.28.94.215.https: Flags [P.], seq 3547:3593, ack 5951, win 404, options [nop,nop,TS val 6279868 ecr 1803331009], length 46
22:11:46.076900 IP 103.28.94.215.https > 192.168.1.10.43012: Flags [.], ack 3593, win 332, options [nop,nop,TS val 1803331020 ecr 6279868], length 0
22:11:46.079626 IP 192.168.1.10.44890 > 151.101.100.133.https: Flags [.], ack 2478874541, win 245, options [nop,nop,TS val 6279872 ecr 1614641639], length 0
22:11:46.100839 IP 151.101.100.133.https > 192.168.1.10.44890: Flags [.], ack 1, win 61, options [nop,nop,TS val 1614652902 ecr 6246114], length 0
22:11:46.207594 IP 192.168.1.10.44892 > 151.101.100.133.https: Flags [.], ack 2292749189, win 245, options [nop,nop,TS val 6279904 ecr 2952451808], length 0
22:11:46.234587 IP 151.101.100.133.https > 192.168.1.10.44892: Flags [.], ack 1, win 61, options [nop,nop,TS val 2952463072 ecr 6246121], length 0
22:11:46.585649 IP ec2-52-21-52-250.compute-1.amazonaws.com.https > 192.168.1.10.50718: Flags [P.], seq 629352096:629352127, ack 2056450410, win 166, options [nop,nop,TS val 5812004 ecr 6264927], length 31
22:11:46.585713 IP 192.168.1.10.50718 > ec2-52-21-52-250.compute-1.amazonaws.com.https: Flags [.], ack 31, win 499, options [nop,nop,TS val 6279998 ecr 5812004], length 0
22:11:47.116235 IP6 fe80::a959:335:80f7:f6c0.6804 > fe80::1.domain: 15611+ PTR? 250.52.21.52.in-addr.arpa. (43)
22:11:47.192462 IP6 fe80::1.domain > fe80::a959:335:80f7:f6c0.6804: 15611 1/5/0 PTR ec2-52-21-52-250.compute-1.amazonaws.com. (210)
22:11:48.895603 IP 192.168.1.10.44808 > 151.101.100.133.https: Flags [.], ack 509995538, win 279, options [nop,nop,TS val 6280576 ecr 1094264192], length 0
22:11:48.918290 IP 151.101.100.133.https > 192.168.1.10.44808: Flags [.], ack 1, win 70, options [nop,nop,TS val 1094275448 ecr 6258069], length 0
22:11:50.175609 IP 192.168.1.10.55612 > 103.28.94.251.https: Flags [.], ack 1382647742, win 254, options [nop,nop,TS val 6280896 ecr 662100283], length 0
22:11:50.181891 IP 103.28.94.251.https > 192.168.1.10.55612: Flags [.], ack 1, win 269, options [nop,nop,TS val 662145337 ecr 6258339], length 0
22:11:50.770322 IP sb-in-f189.1e100.net.https > 192.168.1.10.38082: Flags [P.], seq 2357870935:2357870996, ack 606348468, win 541, options [nop,nop,TS val 2102491543 ecr 6274006], length 61
22:11:50.770380 IP 192.168.1.10.38082 > sb-in-f189.1e100.net.https: Flags [.], ack 61, win 535, options [nop,nop,TS val 6281044 ecr 2102491543], length 0
22:11:50.771472 IP sb-in-f189.1e100.net.https > 192.168.1.10.38082: Flags [P.], seq 61:99, ack 1, win 541, options [nop,nop,TS val 2102491543 ecr 6274006], length 38
22:11:50.771510 IP 192.168.1.10.38082 > sb-in-f189.1e100.net.https: Flags [.], ack 99, win 535, options [nop,nop,TS val 6281044 ecr 2102491543], length 0
22:11:50.771557 IP sb-in-f189.1e100.net.https > 192.168.1.10.38082: Flags [P.], seq 99:145, ack 1, win 541, options [nop,nop,TS val 2102491543 ecr 6274006], length 46
22:11:50.771565 IP 192.168.1.10.38082 > sb-in-f189.1e100.net.https: Flags [.], ack 145, win 535, options [nop,nop,TS val 6281045 ecr 2102491543], length 0
22:11:50.772119 IP 192.168.1.10.38082 > sb-in-f189.1e100.net.https: Flags [P.], seq 1:47, ack 145, win 535, options [nop,nop,TS val 6281045 ecr 2102491543], length 46
22:11:50.799792 IP sb-in-f189.1e100.net.https > 192.168.1.10.38082: Flags [.], ack 47, win 541, options [nop,nop,TS val 2102491569 ecr 6281045], length 0
22:11:51.115872 IP6 fe80::a959:335:80f7:f6c0.36890 > fe80::1.domain: 3902+ PTR? 251.94.28.103.in-addr.arpa. (44)
22:11:51.124611 IP6 fe80::1.domain > fe80::a959:335:80f7:f6c0.36890: 3902 NXDomain 0/1/0 (133)
22:11:51.125019 IP6 fe80::a959:335:80f7:f6c0.49042 > fe80::1.domain: 39647+ PTR? 189.130.125.74.in-addr.arpa. (45)
22:11:51.126711 IP6 fe80::1.domain > fe80::a959:335:80f7:f6c0.49042: 39647 1/0/0 PTR sb-in-f189.1e100.net. (79)
22:11:51.178924 IP 132.245.254.226.https > 192.168.1.10.48302: Flags [P.], seq 1641679972:1641680041, ack 904791317, win 12480, length 69
22:11:51.179261 IP 132.245.254.226.https > 192.168.1.10.48302: Flags [P.], seq 69:186, ack 1, win 12480, length 117
22:11:51.179441 IP 192.168.1.10.48302 > 132.245.254.226.https: Flags [.], ack 186, win 1332, length 0
22:11:51.587319 IP ec2-52-21-52-250.compute-1.amazonaws.com.https > 192.168.1.10.50718: Flags [F.], seq 31, ack 1, win 166, options [nop,nop,TS val 5813255 ecr 6279998], length 0
22:11:51.601308 IP 192.168.1.10.38082 > sb-in-f189.1e100.net.https: Flags [P.], seq 47:278, ack 145, win 535, options [nop,nop,TS val 6281252 ecr 2102491569], length 231
22:11:51.623605 IP 192.168.1.10.50718 > ec2-52-21-52-250.compute-1.amazonaws.com.https: Flags [.], ack 32, win 499, options [nop,nop,TS val 6281258 ecr 5813255], length 0
22:11:51.627767 IP sb-in-f189.1e100.net.https > 192.168.1.10.38082: Flags [.], ack 278, win 560, options [nop,nop,TS val 2102492398 ecr 6281252], length 0
22:11:51.786204 IP sb-in-f189.1e100.net.https > 192.168.1.10.38082: Flags [P.], seq 145:216, ack 278, win 560, options [nop,nop,TS val 2102492557 ecr 6281252], length 71
22:11:51.786499 IP sb-in-f189.1e100.net.https > 192.168.1.10.38082: Flags [P.], seq 216:277, ack 278, win 560, options [nop,nop,TS val 2102492558 ecr 6281252], length 61
22:11:51.787211 IP 192.168.1.10.38082 > sb-in-f189.1e100.net.https: Flags [.], ack 277, win 535, options [nop,nop,TS val 6281298 ecr 2102492557], length 0
22:11:52.115942 IP6 fe80::a959:335:80f7:f6c0.45522 > fe80::1.domain: 23467+ PTR? 226.254.245.132.in-addr.arpa. (46)
22:11:52.122251 IP 192.168.1.10.46756 > 192.30.253.117.https: Flags [F.], seq 1, ack 1, win 286, options [nop,nop,TS val 6281382 ecr 2068105322], length 0
22:11:52.122525 IP 192.168.1.10.50718 > ec2-52-21-52-250.compute-1.amazonaws.com.https: Flags [F.], seq 1, ack 32, win 499, options [nop,nop,TS val 6281382 ecr 5813255], length 0
22:11:52.123073 IP6 fe80::a959:335:80f7:f6c0.30656 > fe80::1.domain: 32678+ A? github.com. (28)
22:11:52.126157 IP6 fe80::1.domain > fe80::a959:335:80f7:f6c0.30656: 32678 1/0/0 A 192.30.253.113 (44)
22:11:52.126501 IP 192.168.1.10.42720 > 192.30.253.113.https: Flags [S], seq 1212376092, win 29200, options [mss 1460,sackOK,TS val 6281383 ecr 0,nop,wscale 7], length 0
22:11:52.126595 IP 192.168.1.10.42722 > 192.30.253.113.https: Flags [S], seq 1248142112, win 29200, options [mss 1460,sackOK,TS val 6281383 ecr 0,nop,wscale 7], length 0
22:11:52.160841 IP6 fe80::1.domain > fe80::a959:335:80f7:f6c0.45522: 23467 NXDomain 0/1/0 (114)
22:11:52.374033 IP 192.168.1.10.42724 > 192.30.253.113.https: Flags [S], seq 3879804253, win 29200, options [mss 1460,sackOK,TS val 6281445 ecr 0,nop,wscale 7], length 0
22:11:52.385775 IP ec2-52-21-52-250.compute-1.amazonaws.com.https > 192.168.1.10.50718: Flags [.], ack 2, win 166, options [nop,nop,TS val 5813454 ecr 6281382], length 0
22:11:52.395414 IP 192.30.253.117.https > 192.168.1.10.46756: Flags [.], ack 2, win 114, options [nop,nop,TS val 2068107873 ecr 6281382], length 0
22:11:52.401507 IP 192.30.253.113.https > 192.168.1.10.42722: Flags [S.], seq 1018328504, ack 1248142113, win 28480, options [mss 1412,sackOK,TS val 2696399376 ecr 6281383,nop,wscale 10], length 0
22:11:52.401602 IP 192.168.1.10.42722 > 192.30.253.113.https: Flags [.], ack 1, win 229, options [nop,nop,TS val 6281452 ecr 2696399376], length 0
22:11:52.402006 IP 192.168.1.10.42722 > 192.30.253.113.https: Flags [P.], seq 1:232, ack 1, win 229, options [nop,nop,TS val 6281452 ecr 2696399376], length 231
22:11:52.410227 IP 192.30.253.113.https > 192.168.1.10.42720: Flags [S.], seq 2068300891, ack 1212376093, win 28480, options [mss 1412,sackOK,TS val 2696399376 ecr 6281383,nop,wscale 10], length 0
22:11:52.410289 IP 192.168.1.10.42720 > 192.30.253.113.https: Flags [.], ack 1, win 229, options [nop,nop,TS val 6281454 ecr 2696399376], length 0
22:11:52.410549 IP 192.168.1.10.42720 > 192.30.253.113.https: Flags [P.], seq 1:232, ack 1, win 229, options [nop,nop,TS val 6281454 ecr 2696399376], length 231
22:11:52.623850 IP sb-in-f189.1e100.net.https > 192.168.1.10.38086: Flags [P.], seq 3407529892:3407529953, ack 755629885, win 536, options [nop,nop,TS val 1499163685 ecr 6274962], length 61
22:11:52.623910 IP 192.168.1.10.38086 > sb-in-f189.1e100.net.https: Flags [.], ack 61, win 404, options [nop,nop,TS val 6281508 ecr 1499163685], length 0
22:11:52.635034 IP 192.30.253.113.https > 192.168.1.10.42724: Flags [S.], seq 119037130, ack 3879804254, win 28480, options [mss 1412,sackOK,TS val 2696399435 ecr 6281445,nop,wscale 10], length 0
22:11:52.635072 IP 192.168.1.10.42724 > 192.30.253.113.https: Flags [.], ack 1, win 229, options [nop,nop,TS val 6281510 ecr 2696399435], length 0
22:11:52.677030 IP 192.30.253.113.https > 192.168.1.10.42722: Flags [.], seq 1:1401, ack 232, win 29, options [nop,nop,TS val 2696399445 ecr 6281452], length 1400
22:11:52.677067 IP 192.168.1.10.42722 > 192.30.253.113.https: Flags [.], ack 1401, win 250, options [nop,nop,TS val 6281521 ecr 2696399445], length 0
22:11:52.680825 IP 192.30.253.113.https > 192.168.1.10.42722: Flags [.], seq 1401:2801, ack 232, win 29, options [nop,nop,TS val 2696399445 ecr 6281452], length 1400
22:11:52.680863 IP 192.168.1.10.42722 > 192.30.253.113.https: Flags [.], ack 2801, win 272, options [nop,nop,TS val 6281522 ecr 2696399445], length 0
22:11:52.680876 IP 192.30.253.113.https > 192.168.1.10.42722: Flags [P.], seq 2801:3606, ack 232, win 29, options [nop,nop,TS val 2696399445 ecr 6281452], length 805
22:11:52.680881 IP 192.168.1.10.42722 > 192.30.253.113.https: Flags [.], ack 3606, win 294, options [nop,nop,TS val 6281522 ecr 2696399445], length 0
22:11:52.684221 IP 192.168.1.10.42722 > 192.30.253.113.https: Flags [P.], seq 232:358, ack 3606, win 294, options [nop,nop,TS val 6281523 ecr 2696399445], length 126
22:11:52.690076 IP 192.168.1.10.42722 > 192.30.253.113.https: Flags [P.], seq 358:1649, ack 3606, win 294, options [nop,nop,TS val 6281524 ecr 2696399445], length 1291
22:11:52.700264 IP 192.30.253.113.https > 192.168.1.10.42720: Flags [.], seq 1:1401, ack 232, win 29, options [nop,nop,TS val 2696399448 ecr 6281454], length 1400
22:11:52.700354 IP 192.168.1.10.42720 > 192.30.253.113.https: Flags [.], ack 1401, win 250, options [nop,nop,TS val 6281527 ecr 2696399448], length 0
22:11:52.700974 IP 192.30.253.113.https > 192.168.1.10.42720: Flags [.], seq 1401:2801, ack 232, win 29, options [nop,nop,TS val 2696399448 ecr 6281454], length 1400
22:11:52.701020 IP 192.168.1.10.42720 > 192.30.253.113.https: Flags [.], ack 2801, win 272, options [nop,nop,TS val 6281527 ecr 2696399448], length 0
22:11:52.701047 IP 192.30.253.113.https > 192.168.1.10.42720: Flags [P.], seq 2801:3606, ack 232, win 29, options [nop,nop,TS val 2696399448 ecr 6281454], length 805
22:11:52.701059 IP 192.168.1.10.42720 > 192.30.253.113.https: Flags [.], ack 3606, win 294, options [nop,nop,TS val 6281527 ecr 2696399448], length 0
22:11:52.705290 IP 192.168.1.10.42720 > 192.30.253.113.https: Flags [P.], seq 232:358, ack 3606, win 294, options [nop,nop,TS val 6281528 ecr 2696399448], length 126
22:11:52.958382 IP 192.30.253.113.https > 192.168.1.10.42722: Flags [P.], seq 3606:3657, ack 358, win 29, options [nop,nop,TS val 2696399515 ecr 6281523], length 51
22:11:52.989873 IP 192.30.253.113.https > 192.168.1.10.42720: Flags [P.], seq 3606:3657, ack 358, win 29, options [nop,nop,TS val 2696399520 ecr 6281528], length 51
22:11:52.995558 IP 192.168.1.10.42722 > 192.30.253.113.https: Flags [.], ack 3657, win 294, options [nop,nop,TS val 6281601 ecr 2696399515], length 0
22:11:52.999536 IP 192.30.253.113.https > 192.168.1.10.42722: Flags [.], ack 1649, win 32, options [nop,nop,TS val 2696399526 ecr 6281524], length 0
22:11:53.027574 IP 192.168.1.10.42720 > 192.30.253.113.https: Flags [.], ack 3657, win 294, options [nop,nop,TS val 6281609 ecr 2696399520], length 0
22:11:53.116049 IP6 fe80::a959:335:80f7:f6c0.3084 > fe80::1.domain: 38335+ PTR? 113.253.30.192.in-addr.arpa. (45)
22:11:53.151577 IP6 fe80::1.domain > fe80::a959:335:80f7:f6c0.3084: 38335 NXDomain 0/1/0 (113)
22:11:53.183955 IP 192.30.253.113.https > 192.168.1.10.42722: Flags [P.], seq 3657:5056, ack 1649, win 32, options [nop,nop,TS val 2696399571 ecr 6281524], length 1399
22:11:53.183998 IP 192.168.1.10.42722 > 192.30.253.113.https: Flags [.], ack 5056, win 316, options [nop,nop,TS val 6281648 ecr 2696399571], length 0
22:11:53.184930 IP 192.30.253.113.https > 192.168.1.10.42722: Flags [P.], seq 5056:5967, ack 1649, win 32, options [nop,nop,TS val 2696399571 ecr 6281524], length 911
22:11:53.184947 IP 192.168.1.10.42722 > 192.30.253.113.https: Flags [.], ack 5967, win 338, options [nop,nop,TS val 6281648 ecr 2696399571], length 0
22:11:53.187034 IP 192.30.253.113.https > 192.168.1.10.42722: Flags [P.], seq 5967:7366, ack 1649, win 32, options [nop,nop,TS val 2696399572 ecr 6281524], length 1399
22:11:53.187057 IP 192.168.1.10.42722 > 192.30.253.113.https: Flags [.], ack 7366, win 360, options [nop,nop,TS val 6281648 ecr 2696399572], length 0
22:11:53.187074 IP 192.30.253.113.https > 192.168.1.10.42722: Flags [P.], seq 7366:8765, ack 1649, win 32, options [nop,nop,TS val 2696399572 ecr 6281524], length 1399
22:11:53.187084 IP 192.168.1.10.42722 > 192.30.253.113.https: Flags [.], ack 8765, win 382, options [nop,nop,TS val 6281648 ecr 2696399572], length 0
22:11:53.187093 IP 192.30.253.113.https > 192.168.1.10.42722: Flags [P.], seq 8765:10164, ack 1649, win 32, options [nop,nop,TS val 2696399572 ecr 6281524], length 1399
22:11:53.187103 IP 192.168.1.10.42722 > 192.30.253.113.https: Flags [.], ack 10164, win 404, options [nop,nop,TS val 6281648 ecr 2696399572], length 0
22:11:53.187114 IP 192.30.253.113.https > 192.168.1.10.42722: Flags [P.], seq 10164:11563, ack 1649, win 32, options [nop,nop,TS val 2696399572 ecr 6281524], length 1399
22:11:53.187121 IP 192.168.1.10.42722 > 192.30.253.113.https: Flags [.], ack 11563, win 425, options [nop,nop,TS val 6281648 ecr 2696399572], length 0
22:11:53.187132 IP 192.30.253.113.https > 192.168.1.10.42722: Flags [P.], seq 11563:12962, ack 1649, win 32, options [nop,nop,TS val 2696399572 ecr 6281524], length 1399
22:11:53.187138 IP 192.168.1.10.42722 > 192.30.253.113.https: Flags [.], ack 12962, win 447, options [nop,nop,TS val 6281648 ecr 2696399572], length 0
22:11:53.187149 IP 192.30.253.113.https > 192.168.1.10.42722: Flags [P.], seq 12962:14361, ack 1649, win 32, options [nop,nop,TS val 2696399572 ecr 6281524], length 1399
22:11:53.187155 IP 192.168.1.10.42722 > 192.30.253.113.https: Flags [.], ack 14361, win 469, options [nop,nop,TS val 6281648 ecr 2696399572], length 0
22:11:53.187165 IP 192.30.253.113.https > 192.168.1.10.42722: Flags [P.], seq 14361:15760, ack 1649, win 32, options [nop,nop,TS val 2696399572 ecr 6281524], length 1399
22:11:53.187171 IP 192.168.1.10.42722 > 192.30.253.113.https: Flags [.], ack 15760, win 491, options [nop,nop,TS val 6281648 ecr 2696399572], length 0
22:11:53.457610 IP 192.30.253.113.https > 192.168.1.10.42722: Flags [.], seq 15760:17160, ack 1649, win 32, options [nop,nop,TS val 2696399640 ecr 6281648], length 1400
22:11:53.457671 IP 192.168.1.10.42722 > 192.30.253.113.https: Flags [.], ack 17160, win 513, options [nop,nop,TS val 6281716 ecr 2696399640], length 0
22:11:53.458392 IP 192.30.253.113.https > 192.168.1.10.42722: Flags [.], seq 17160:18560, ack 1649, win 32, options [nop,nop,TS val 2696399640 ecr 6281648], length 1400
22:11:53.458406 IP 192.168.1.10.42722 > 192.30.253.113.https: Flags [.], ack 18560, win 535, options [nop,nop,TS val 6281716 ecr 2696399640], length 0
22:11:53.460279 IP 192.30.253.113.https > 192.168.1.10.42722: Flags [.], seq 18560:19960, ack 1649, win 32, options [nop,nop,TS val 2696399641 ecr 6281648], length 1400
22:11:53.460309 IP 192.168.1.10.42722 > 192.30.253.113.https: Flags [.], ack 19960, win 557, options [nop,nop,TS val 6281717 ecr 2696399641], length 0
22:11:53.461579 IP 192.30.253.113.https > 192.168.1.10.42722: Flags [.], seq 19960:21360, ack 1649, win 32, options [nop,nop,TS val 2696399641 ecr 6281648], length 1400
22:11:53.461613 IP 192.168.1.10.42722 > 192.30.253.113.https: Flags [.], ack 21360, win 579, options [nop,nop,TS val 6281717 ecr 2696399641], length 0
22:11:53.461645 IP 192.30.253.113.https > 192.168.1.10.42722: Flags [.], seq 21360:22760, ack 1649, win 32, options [nop,nop,TS val 2696399641 ecr 6281648], length 1400
22:11:53.461652 IP 192.168.1.10.42722 > 192.30.253.113.https: Flags [.], ack 22760, win 600, options [nop,nop,TS val 6281717 ecr 2696399641], length 0
22:11:53.461657 IP 192.30.253.113.https > 192.168.1.10.42722: Flags [.], seq 22760:24160, ack 1649, win 32, options [nop,nop,TS val 2696399641 ecr 6281648], length 1400
22:11:53.461675 IP 192.168.1.10.42722 > 192.30.253.113.https: Flags [.], ack 24160, win 622, options [nop,nop,TS val 6281717 ecr 2696399641], length 0
22:11:53.463565 IP 192.30.253.113.https > 192.168.1.10.42722: Flags [.], seq 24160:25560, ack 1649, win 32, options [nop,nop,TS val 2696399641 ecr 6281648], length 1400
22:11:53.463597 IP 192.168.1.10.42722 > 192.30.253.113.https: Flags [.], ack 25560, win 644, options [nop,nop,TS val 6281718 ecr 2696399641], length 0
22:11:53.464422 IP 192.30.253.113.https > 192.168.1.10.42722: Flags [.], seq 25560:26960, ack 1649, win 32, options [nop,nop,TS val 2696399641 ecr 6281648], length 1400
22:11:53.464436 IP 192.168.1.10.42722 > 192.30.253.113.https: Flags [.], ack 26960, win 666, options [nop,nop,TS val 6281718 ecr 2696399641], length 0
22:11:53.464446 IP 192.30.253.113.https > 192.168.1.10.42722: Flags [.], seq 26960:28360, ack 1649, win 32, options [nop,nop,TS val 2696399641 ecr 6281648], length 1400
22:11:53.464451 IP 192.168.1.10.42722 > 192.30.253.113.https: Flags [.], ack 28360, win 688, options [nop,nop,TS val 6281718 ecr 2696399641], length 0
22:11:53.465113 IP 192.30.253.113.https > 192.168.1.10.42722: Flags [.], seq 28360:29760, ack 1649, win 32, options [nop,nop,TS val 2696399641 ecr 6281648], length 1400
22:11:53.465142 IP 192.168.1.10.42722 > 192.30.253.113.https: Flags [.], ack 29760, win 710, options [nop,nop,TS val 6281718 ecr 2696399641], length 0
22:11:53.734160 IP 192.30.253.113.https > 192.168.1.10.42722: Flags [.], seq 29760:31160, ack 1649, win 32, options [nop,nop,TS val 2696399708 ecr 6281716], length 1400
22:11:53.734238 IP 192.168.1.10.42722 > 192.30.253.113.https: Flags [.], ack 31160, win 732, options [nop,nop,TS val 6281785 ecr 2696399708], length 0
22:11:53.734723 IP 192.30.253.113.https > 192.168.1.10.42722: Flags [.], seq 31160:32560, ack 1649, win 32, options [nop,nop,TS val 2696399708 ecr 6281716], length 1400
22:11:53.734752 IP 192.168.1.10.42722 > 192.30.253.113.https: Flags [.], ack 32560, win 754, options [nop,nop,TS val 6281785 ecr 2696399708], length 0
22:11:53.737157 IP 192.30.253.113.https > 192.168.1.10.42722: Flags [.], seq 32560:33960, ack 1649, win 32, options [nop,nop,TS val 2696399709 ecr 6281717], length 1400
22:11:53.737197 IP 192.168.1.10.42722 > 192.30.253.113.https: Flags [.], ack 33960, win 775, options [nop,nop,TS val 6281786 ecr 2696399709], length 0
22:11:53.737637 IP 192.30.253.113.https > 192.168.1.10.42722: Flags [.], seq 33960:35360, ack 1649, win 32, options [nop,nop,TS val 2696399709 ecr 6281717], length 1400
22:11:53.737652 IP 192.168.1.10.42722 > 192.30.253.113.https: Flags [.], ack 35360, win 797, options [nop,nop,TS val 6281786 ecr 2696399709], length 0
22:11:53.738488 IP 192.30.253.113.https > 192.168.1.10.42722: Flags [.], seq 35360:36760, ack 1649, win 32, options [nop,nop,TS val 2696399709 ecr 6281717], length 1400
22:11:53.738502 IP 192.168.1.10.42722 > 192.30.253.113.https: Flags [.], ack 36760, win 819, options [nop,nop,TS val 6281786 ecr 2696399709], length 0
22:11:53.738512 IP 192.30.253.113.https > 192.168.1.10.42722: Flags [.], seq 36760:38160, ack 1649, win 32, options [nop,nop,TS val 2696399709 ecr 6281717], length 1400
22:11:53.738518 IP 192.168.1.10.42722 > 192.30.253.113.https: Flags [.], ack 38160, win 841, options [nop,nop,TS val 6281786 ecr 2696399709], length 0
22:11:53.739159 IP 192.30.253.113.https > 192.168.1.10.42722: Flags [.], seq 38160:39560, ack 1649, win 32, options [nop,nop,TS val 2696399710 ecr 6281718], length 1400
22:11:53.739169 IP 192.168.1.10.42722 > 192.30.253.113.https: Flags [.], ack 39560, win 863, options [nop,nop,TS val 6281786 ecr 2696399710], length 0
22:11:53.739732 IP 192.30.253.113.https > 192.168.1.10.42722: Flags [.], seq 39560:40960, ack 1649, win 32, options [nop,nop,TS val 2696399710 ecr 6281718], length 1400
22:11:53.739741 IP 192.168.1.10.42722 > 192.30.253.113.https: Flags [.], ack 40960, win 885, options [nop,nop,TS val 6281787 ecr 2696399710], length 0
22:11:53.740608 IP 192.30.253.113.https > 192.168.1.10.42722: Flags [.], seq 40960:42360, ack 1649, win 32, options [nop,nop,TS val 2696399710 ecr 6281718], length 1400
22:11:53.740622 IP 192.168.1.10.42722 > 192.30.253.113.https: Flags [.], ack 42360, win 907, options [nop,nop,TS val 6281787 ecr 2696399710], length 0
22:11:53.740630 IP 192.30.253.113.https > 192.168.1.10.42722: Flags [.], seq 42360:43760, ack 1649, win 32, options [nop,nop,TS val 2696399710 ecr 6281718], length 1400
22:11:53.740635 IP 192.168.1.10.42722 > 192.30.253.113.https: Flags [.], ack 43760, win 929, options [nop,nop,TS val 6281787 ecr 2696399710], length 0
22:11:53.743529 IP 192.168.1.10.57580 > edge-star-shv-01-sin6.facebook.com.https: Flags [.], ack 581095808, win 1059, options [nop,nop,TS val 6281788 ecr 2822895307], length 0
22:11:53.791654 IP edge-star-shv-01-sin6.facebook.com.https > 192.168.1.10.57580: Flags [.], ack 1, win 2043, options [nop,nop,TS val 2822940370 ecr 6270544], length 0
22:11:54.010847 IP 192.30.253.113.https > 192.168.1.10.42722: Flags [.], seq 43760:45160, ack 1649, win 32, options [nop,nop,TS val 2696399778 ecr 6281785], length 1400
22:11:54.010916 IP 192.168.1.10.42722 > 192.30.253.113.https: Flags [.], ack 45160, win 950, options [nop,nop,TS val 6281854 ecr 2696399778], length 0
22:11:54.011917 IP 192.30.253.113.https > 192.168.1.10.42722: Flags [.], seq 45160:46560, ack 1649, win 32, options [nop,nop,TS val 2696399778 ecr 6281785], length 1400
22:11:54.011961 IP 192.168.1.10.42722 > 192.30.253.113.https: Flags [.], ack 46560, win 972, options [nop,nop,TS val 6281855 ecr 2696399778], length 0
22:11:54.011996 IP 192.30.253.113.https > 192.168.1.10.42722: Flags [.], seq 46560:47960, ack 1649, win 32, options [nop,nop,TS val 2696399778 ecr 6281785], length 1400
22:11:54.012016 IP 192.168.1.10.42722 > 192.30.253.113.https: Flags [.], ack 47960, win 994, options [nop,nop,TS val 6281855 ecr 2696399778], length 0
22:11:54.012036 IP 192.30.253.113.https > 192.168.1.10.42722: Flags [.], seq 47960:49360, ack 1649, win 32, options [nop,nop,TS val 2696399778 ecr 6281785], length 1400
22:11:54.012050 IP 192.168.1.10.42722 > 192.30.253.113.https: Flags [.], ack 49360, win 1016, options [nop,nop,TS val 6281855 ecr 2696399778], length 0
22:11:54.029999 IP 192.30.253.113.https > 192.168.1.10.42722: Flags [.], seq 49360:50760, ack 1649, win 32, options [nop,nop,TS val 2696399783 ecr 6281786], length 1400
22:11:54.030080 IP 192.168.1.10.42722 > 192.30.253.113.https: Flags [.], ack 50760, win 1038, options [nop,nop,TS val 6281859 ecr 2696399783], length 0
22:11:54.031203 IP 192.30.253.113.https > 192.168.1.10.42722: Flags [.], seq 50760:52160, ack 1649, win 32, options [nop,nop,TS val 2696399783 ecr 6281786], length 1400
22:11:54.031248 IP 192.168.1.10.42722 > 192.30.253.113.https: Flags [.], ack 52160, win 1060, options [nop,nop,TS val 6281859 ecr 2696399783], length 0
22:11:54.031284 IP 192.30.253.113.https > 192.168.1.10.42722: Flags [.], seq 52160:53560, ack 1649, win 32, options [nop,nop,TS val 2696399783 ecr 6281786], length 1400
22:11:54.031299 IP 192.168.1.10.42722 > 192.30.253.113.https: Flags [.], ack 53560, win 1082, options [nop,nop,TS val 6281859 ecr 2696399783], length 0
22:11:54.031316 IP 192.30.253.113.https > 192.168.1.10.42722: Flags [.], seq 53560:54960, ack 1649, win 32, options [nop,nop,TS val 2696399783 ecr 6281786], length 1400
22:11:54.031327 IP 192.168.1.10.42722 > 192.30.253.113.https: Flags [.], ack 54960, win 1104, options [nop,nop,TS val 6281859 ecr 2696399783], length 0
22:11:54.031340 IP 192.30.253.113.https > 192.168.1.10.42722: Flags [.], seq 54960:56360, ack 1649, win 32, options [nop,nop,TS val 2696399783 ecr 6281787], length 1400
22:11:54.031349 IP 192.168.1.10.42722 > 192.30.253.113.https: Flags [.], ack 56360, win 1125, options [nop,nop,TS val 6281859 ecr 2696399783], length 0
22:11:54.032360 IP 192.30.253.113.https > 192.168.1.10.42722: Flags [.], seq 56360:57760, ack 1649, win 32, options [nop,nop,TS val 2696399783 ecr 6281787], length 1400
22:11:54.032419 IP 192.168.1.10.42722 > 192.30.253.113.https: Flags [.], ack 57760, win 1147, options [nop,nop,TS val 6281860 ecr 2696399783], length 0
22:11:54.032465 IP 192.30.253.113.https > 192.168.1.10.42722: Flags [.], seq 57760:59160, ack 1649, win 32, options [nop,nop,TS val 2696399783 ecr 6281787], length 1400
22:11:54.032487 IP 192.168.1.10.42722 > 192.30.253.113.https: Flags [.], ack 59160, win 1169, options [nop,nop,TS val 6281860 ecr 2696399783], length 0
22:11:54.032508 IP 192.30.253.113.https > 192.168.1.10.42722: Flags [.], seq 59160:60560, ack 1649, win 32, options [nop,nop,TS val 2696399783 ecr 6281787], length 1400
22:11:54.032522 IP 192.168.1.10.42722 > 192.30.253.113.https: Flags [.], ack 60560, win 1191, options [nop,nop,TS val 6281860 ecr 2696399783], length 0
22:11:54.116850 IP6 fe80::a959:335:80f7:f6c0.50983 > fe80::1.domain: 9980+ PTR? 20.7.240.157.in-addr.arpa. (43)
22:11:54.141198 IP6 fe80::1.domain > fe80::a959:335:80f7:f6c0.50983: 9980 1/0/0 PTR edge-star-shv-01-sin6.facebook.com. (91)
22:11:54.160580 IP 192.30.253.113.https > 192.168.1.10.42724: Flags [S.], seq 119037130, ack 3879804254, win 28480, options [mss 1412,sackOK,TS val 2696399817 ecr 6281510,nop,wscale 10], length 0
22:11:54.160634 IP 192.168.1.10.42724 > 192.30.253.113.https: Flags [.], ack 1, win 229, options [nop,nop,TS val 6281892 ecr 2696399435], length 0
22:11:54.287103 IP 192.30.253.113.https > 192.168.1.10.42722: Flags [.], seq 60560:61960, ack 1649, win 32, options [nop,nop,TS val 2696399847 ecr 6281855], length 1400
22:11:54.287154 IP 192.168.1.10.42722 > 192.30.253.113.https: Flags [.], ack 61960, win 1213, options [nop,nop,TS val 6281923 ecr 2696399847], length 0
22:11:54.288093 IP 192.30.253.113.https > 192.168.1.10.42722: Flags [.], seq 61960:63360, ack 1649, win 32, options [nop,nop,TS val 2696399847 ecr 6281855], length 1400
22:11:54.288111 IP 192.168.1.10.42722 > 192.30.253.113.https: Flags [.], ack 63360, win 1235, options [nop,nop,TS val 6281924 ecr 2696399847], length 0
22:11:54.288128 IP 192.30.253.113.https > 192.168.1.10.42722: Flags [.], seq 63360:64760, ack 1649, win 32, options [nop,nop,TS val 2696399847 ecr 6281855], length 1400
22:11:54.288134 IP 192.168.1.10.42722 > 192.30.253.113.https: Flags [.], ack 64760, win 1257, options [nop,nop,TS val 6281924 ecr 2696399847], length 0
22:11:54.288142 IP 192.30.253.113.https > 192.168.1.10.42722: Flags [P.], seq 64760:66160, ack 1649, win 32, options [nop,nop,TS val 2696399847 ecr 6281855], length 1400
