22:16:14.879602 IP 192.168.1.10.52780 > 74.125.130.19.443: Flags [.], ack 446192673, win 398, options [nop,nop,TS val 6347072 ecr 642596317], length 0
22:16:14.915743 IP 74.125.130.19.443 > 192.168.1.10.52780: Flags [.], ack 1, win 413, options [nop,nop,TS val 642641373 ecr 6302011], length 0
22:16:16.159630 IP 192.168.1.10.59052 > 103.28.94.241.443: Flags [.], ack 1603232480, win 293, options [nop,nop,TS val 6347392 ecr 662366183], length 0
22:16:16.178908 IP 103.28.94.241.443 > 192.168.1.10.59052: Flags [.], ack 1, win 336, options [nop,nop,TS val 662411321 ecr 6336097], length 0
22:16:16.927534 IP 192.168.1.10.35082 > 103.28.94.245.443: Flags [.], ack 4232363242, win 245, options [nop,nop,TS val 6347584 ecr 662367033], length 0
22:16:16.934870 IP 103.28.94.245.443 > 192.168.1.10.35082: Flags [.], ack 1, win 244, options [nop,nop,TS val 662412088 ecr 6313773], length 0
22:16:18.847531 IP 192.168.1.10.35702 > 103.28.94.236.443: Flags [.], ack 785549623, win 245, options [nop,nop,TS val 6348064 ecr 757775074], length 0
22:16:18.854421 IP 103.28.94.236.443 > 192.168.1.10.35702: Flags [.], ack 1, win 253, options [nop,nop,TS val 757820130 ecr 6314267], length 0
22:16:18.975553 IP 192.168.1.10.59084 > 103.28.94.241.443: Flags [.], ack 2945037890, win 425, options [nop,nop,TS val 6348096 ecr 662369081], length 0
22:16:18.988300 IP 103.28.94.241.443 > 192.168.1.10.59084: Flags [.], ack 1, win 332, options [nop,nop,TS val 662414136 ecr 6314282], length 0
22:16:19.231552 IP 192.168.1.10.44808 > 151.101.100.133.443: Flags [.], ack 509996477, win 296, options [nop,nop,TS val 6348160 ecr 1094331743], length 0
22:16:19.252743 IP 151.101.100.133.443 > 192.168.1.10.44808: Flags [.], ack 1, win 75, options [nop,nop,TS val 1094343031 ecr 6336876], length 0
22:16:20.230620 IP 192.30.253.125.443 > 192.168.1.10.49858: Flags [P.], seq 919803955:919803986, ack 1667471513, win 31, options [nop,nop,TS val 1460295141 ecr 6340913], length 31
22:16:20.230643 IP 192.168.1.10.49858 > 192.30.253.125.443: Flags [.], ack 31, win 360, options [nop,nop,TS val 6348409 ecr 1460295141], length 0
22:16:20.230756 IP 192.168.1.10.49858 > 192.30.253.125.443: Flags [P.], seq 1:36, ack 31, win 360, options [nop,nop,TS val 6348409 ecr 1460295141], length 35
22:16:20.253607 IP 192.168.1.10.35518 > 192.30.253.116.443: Flags [F.], seq 3963690516, ack 593804824, win 249, options [nop,nop,TS val 6348415 ecr 2068170868], length 0
22:16:20.253695 IP 192.168.1.10.44944 > 151.101.100.133.443: Flags [F.], seq 1075597535, ack 640951052, win 469, options [nop,nop,TS val 6348415 ecr 2654458047], length 0
22:16:20.253755 IP 192.168.1.10.34240 > 192.30.253.112.443: Flags [F.], seq 2345925563, ack 3534462744, win 303, options [nop,nop,TS val 6348415 ecr 2696461655], length 0
22:16:20.253803 IP 192.168.1.10.34238 > 192.30.253.112.443: Flags [F.], seq 1495581559, ack 830134920, win 303, options [nop,nop,TS val 6348415 ecr 2696461658], length 0
22:16:20.253846 IP 192.168.1.10.34234 > 192.30.253.112.443: Flags [F.], seq 3472479317, ack 493783264, win 368, options [nop,nop,TS val 6348415 ecr 2696461662], length 0
22:16:20.253891 IP 192.168.1.10.34236 > 192.30.253.112.443: Flags [F.], seq 420563795, ack 4107288752, win 303, options [nop,nop,TS val 6348415 ecr 2696461665], length 0
22:16:20.253935 IP 192.168.1.10.34232 > 192.30.253.112.443: Flags [F.], seq 3468846386, ack 3691409148, win 434, options [nop,nop,TS val 6348415 ecr 2696461825], length 0
22:16:20.253978 IP 192.168.1.10.34230 > 192.30.253.112.443: Flags [F.], seq 1023200651, ack 1637899312, win 784, options [nop,nop,TS val 6348415 ecr 2696461833], length 0
22:16:20.254088 IP 192.168.1.10.35520 > 192.30.253.116.443: Flags [F.], seq 2671253753, ack 3028779598, win 229, options [nop,nop,TS val 6348415 ecr 2068168215], length 0
22:16:20.254174 IP 192.168.1.10.34260 > 192.30.253.112.443: Flags [S], seq 1417711925, win 29200, options [mss 1460,sackOK,TS val 6348415 ecr 0,nop,wscale 7], length 0
22:16:20.254423 IP 192.168.1.10.34262 > 192.30.253.112.443: Flags [S], seq 1681369328, win 29200, options [mss 1460,sackOK,TS val 6348415 ecr 0,nop,wscale 7], length 0
22:16:20.275370 IP 151.101.100.133.443 > 192.168.1.10.44944: Flags [P.], seq 1:32, ack 1, win 62, options [nop,nop,TS val 2654460895 ecr 6348415], length 31
22:16:20.275410 IP 192.168.1.10.44944 > 151.101.100.133.443: Flags [R], seq 1075597536, win 0, length 0
22:16:20.275993 IP 151.101.100.133.443 > 192.168.1.10.44944: Flags [F.], seq 32, ack 1, win 62, options [nop,nop,TS val 2654460895 ecr 6348415], length 0
22:16:20.276019 IP 192.168.1.10.44944 > 151.101.100.133.443: Flags [R], seq 1075597536, win 0, length 0
22:16:20.493606 IP 192.30.253.125.443 > 192.168.1.10.49858: Flags [.], ack 36, win 31, options [nop,nop,TS val 1460295206 ecr 6348409], length 0
22:16:20.504521 IP 192.168.1.10.34264 > 192.30.253.112.443: Flags [S], seq 499481797, win 29200, options [mss 1460,sackOK,TS val 6348478 ecr 0,nop,wscale 7], length 0
22:16:20.513792 IP 192.30.253.112.443 > 192.168.1.10.34240: Flags [.], ack 1, win 31, options [nop,nop,TS val 2696466405 ecr 6348415], length 0
22:16:20.520768 IP 192.30.253.112.443 > 192.168.1.10.34260: Flags [S.], seq 3548462503, ack 1417711926, win 28480, options [mss 1412,sackOK,TS val 2696466405 ecr 6348415,nop,wscale 10], length 0
22:16:20.520840 IP 192.168.1.10.34260 > 192.30.253.112.443: Flags [.], ack 1, win 229, options [nop,nop,TS val 6348482 ecr 2696466405], length 0
22:16:20.521100 IP 192.30.253.112.443 > 192.168.1.10.34238: Flags [.], ack 1, win 31, options [nop,nop,TS val 2696466406 ecr 6348415], length 0
22:16:20.521239 IP 192.168.1.10.34260 > 192.30.253.112.443: Flags [P.], seq 1:232, ack 1, win 229, options [nop,nop,TS val 6348482 ecr 2696466405], length 231
22:16:20.521465 IP 192.30.253.112.443 > 192.168.1.10.34236: Flags [.], ack 1, win 31, options [nop,nop,TS val 2696466404 ecr 6348415], length 0
22:16:20.523676 IP 192.30.253.112.443 > 192.168.1.10.34230: Flags [.], ack 1, win 49, options [nop,nop,TS val 2696466405 ecr 6348415], length 0
22:16:20.524158 IP 192.30.253.112.443 > 192.168.1.10.34262: Flags [S.], seq 2419681835, ack 1681369329, win 28480, options [mss 1412,sackOK,TS val 2696466406 ecr 6348415,nop,wscale 10], length 0
22:16:20.524223 IP 192.168.1.10.34262 > 192.30.253.112.443: Flags [.], ack 1, win 229, options [nop,nop,TS val 6348483 ecr 2696466406], length 0
22:16:20.524561 IP 192.168.1.10.34262 > 192.30.253.112.443: Flags [P.], seq 1:232, ack 1, win 229, options [nop,nop,TS val 6348483 ecr 2696466406], length 231
22:16:20.530714 IP 192.30.253.116.443 > 192.168.1.10.35520: Flags [F.], seq 1, ack 1, win 28, options [nop,nop,TS val 2068174906 ecr 6348415], length 0
22:16:20.530736 IP 192.168.1.10.35520 > 192.30.253.116.443: Flags [.], ack 2, win 229, options [nop,nop,TS val 6348484 ecr 2068174906], length 0
22:16:20.531481 IP 192.30.253.112.443 > 192.168.1.10.34234: Flags [.], ack 1, win 33, options [nop,nop,TS val 2696466407 ecr 6348415], length 0
22:16:20.532207 IP 192.30.253.116.443 > 192.168.1.10.35518: Flags [.], ack 1, win 58, options [nop,nop,TS val 2068174906 ecr 6348415], length 0
22:16:20.532499 IP 192.30.253.112.443 > 192.168.1.10.34232: Flags [.], ack 1, win 35, options [nop,nop,TS val 2696466406 ecr 6348415], length 0
22:16:20.784117 IP 192.30.253.112.443 > 192.168.1.10.34264: Flags [S.], seq 3743278326, ack 499481798, win 28480, options [mss 1412,sackOK,TS val 2696466470 ecr 6348478,nop,wscale 10], length 0
22:16:20.784184 IP 192.168.1.10.34264 > 192.30.253.112.443: Flags [.], ack 1, win 229, options [nop,nop,TS val 6348548 ecr 2696466470], length 0
22:16:20.787017 IP 192.30.253.112.443 > 192.168.1.10.34260: Flags [P.], seq 1:153, ack 232, win 29, options [nop,nop,TS val 2696466472 ecr 6348482], length 152
22:16:20.787081 IP 192.168.1.10.34260 > 192.30.253.112.443: Flags [.], ack 153, win 237, options [nop,nop,TS val 6348548 ecr 2696466472], length 0
22:16:20.787736 IP 192.168.1.10.34260 > 192.30.253.112.443: Flags [P.], seq 232:283, ack 153, win 237, options [nop,nop,TS val 6348549 ecr 2696466472], length 51
22:16:20.794780 IP 192.30.253.112.443 > 192.168.1.10.34262: Flags [P.], seq 1:153, ack 232, win 29, options [nop,nop,TS val 2696466474 ecr 6348483], length 152
22:16:20.794826 IP 192.168.1.10.34262 > 192.30.253.112.443: Flags [.], ack 153, win 237, options [nop,nop,TS val 6348550 ecr 2696466474], length 0
22:16:20.801176 IP 192.168.1.10.34262 > 192.30.253.112.443: Flags [P.], seq 232:283, ack 153, win 237, options [nop,nop,TS val 6348552 ecr 2696466474], length 51
22:16:20.811665 IP 192.168.1.10.34260 > 192.30.253.112.443: Flags [P.], seq 283:1580, ack 153, win 237, options [nop,nop,TS val 6348555 ecr 2696466472], length 1297
22:16:20.895525 IP 192.168.1.10.55612 > 103.28.94.251.443: Flags [.], ack 1382648698, win 262, options [nop,nop,TS val 6348576 ecr 662371021], length 0
22:16:20.901240 IP 103.28.94.251.443 > 192.168.1.10.55612: Flags [.], ack 1, win 302, options [nop,nop,TS val 662416056 ecr 6337306], length 0
22:16:21.078262 IP 192.30.253.112.443 > 192.168.1.10.34260: Flags [.], ack 1580, win 32, options [nop,nop,TS val 2696466544 ecr 6348549], length 0
22:16:21.108476 IP 192.30.253.112.443 > 192.168.1.10.34262: Flags [.], ack 283, win 29, options [nop,nop,TS val 2696466553 ecr 6348552], length 0
22:16:21.611163 IP 192.30.253.112.443 > 192.168.1.10.34260: Flags [P.], seq 153:1552, ack 1580, win 32, options [nop,nop,TS val 2696466678 ecr 6348549], length 1399
22:16:21.613726 IP 192.30.253.112.443 > 192.168.1.10.34260: Flags [P.], seq 1552:2951, ack 1580, win 32, options [nop,nop,TS val 2696466678 ecr 6348549], length 1399
22:16:21.613789 IP 192.168.1.10.34260 > 192.30.253.112.443: Flags [.], ack 2951, win 281, options [nop,nop,TS val 6348755 ecr 2696466678], length 0
22:16:21.613832 IP 192.30.253.112.443 > 192.168.1.10.34260: Flags [P.], seq 2951:4350, ack 1580, win 32, options [nop,nop,TS val 2696466678 ecr 6348549], length 1399
22:16:21.613868 IP 192.30.253.112.443 > 192.168.1.10.34260: Flags [P.], seq 4350:5749, ack 1580, win 32, options [nop,nop,TS val 2696466678 ecr 6348549], length 1399
22:16:21.613876 IP 192.30.253.112.443 > 192.168.1.10.34260: Flags [P.], seq 5749:7148, ack 1580, win 32, options [nop,nop,TS val 2696466678 ecr 6348549], length 1399
22:16:21.613881 IP 192.168.1.10.34260 > 192.30.253.112.443: Flags [.], ack 5749, win 324, options [nop,nop,TS val 6348755 ecr 2696466678], length 0
22:16:21.614476 IP 192.30.253.112.443 > 192.168.1.10.34260: Flags [P.], seq 7148:8547, ack 1580, win 32, options [nop,nop,TS val 2696466678 ecr 6348549], length 1399
22:16:21.614490 IP 192.168.1.10.34260 > 192.30.253.112.443: Flags [.], ack 8547, win 368, options [nop,nop,TS val 6348755 ecr 2696466678], length 0
22:16:21.614504 IP 192.30.253.112.443 > 192.168.1.10.34260: Flags [P.], seq 8547:9946, ack 1580, win 32, options [nop,nop,TS val 2696466678 ecr 6348549], length 1399
22:16:21.614512 IP 192.30.253.112.443 > 192.168.1.10.34260: Flags [P.], seq 9946:11345, ack 1580, win 32, options [nop,nop,TS val 2696466678 ecr 6348549], length 1399
22:16:21.614517 IP 192.168.1.10.34260 > 192.30.253.112.443: Flags [.], ack 11345, win 412, options [nop,nop,TS val 6348755 ecr 2696466678], length 0
22:16:21.614524 IP 192.30.253.112.443 > 192.168.1.10.34260: Flags [P.], seq 11345:12744, ack 1580, win 32, options [nop,nop,TS val 2696466678 ecr 6348549], length 1399
22:16:21.614530 IP 192.30.253.112.443 > 192.168.1.10.34260: Flags [P.], seq 12744:14143, ack 1580, win 32, options [nop,nop,TS val 2696466678 ecr 6348549], length 1399
22:16:21.614534 IP 192.168.1.10.34260 > 192.30.253.112.443: Flags [.], ack 14143, win 456, options [nop,nop,TS val 6348755 ecr 2696466678], length 0
22:16:21.880031 IP 192.30.253.112.443 > 192.168.1.10.34260: Flags [.], seq 14143:15543, ack 1580, win 32, options [nop,nop,TS val 2696466745 ecr 6348755], length 1400
22:16:21.882511 IP 192.30.253.112.443 > 192.168.1.10.34260: Flags [.], seq 15543:16943, ack 1580, win 32, options [nop,nop,TS val 2696466745 ecr 6348755], length 1400
22:16:21.882541 IP 192.168.1.10.34260 > 192.30.253.112.443: Flags [.], ack 16943, win 499, options [nop,nop,TS val 6348822 ecr 2696466745], length 0
22:16:21.882570 IP 192.30.253.112.443 > 192.168.1.10.34260: Flags [.], seq 16943:18343, ack 1580, win 32, options [nop,nop,TS val 2696466745 ecr 6348755], length 1400
22:16:21.882584 IP 192.30.253.112.443 > 192.168.1.10.34260: Flags [.], seq 18343:19743, ack 1580, win 32, options [nop,nop,TS val 2696466745 ecr 6348755], length 1400
22:16:21.882597 IP 192.168.1.10.34260 > 192.30.253.112.443: Flags [.], ack 19743, win 543, options [nop,nop,TS val 6348822 ecr 2696466745], length 0
22:16:21.882608 IP 192.30.253.112.443 > 192.168.1.10.34260: Flags [.], seq 19743:21143, ack 1580, win 32, options [nop,nop,TS val 2696466745 ecr 6348755], length 1400
22:16:21.882620 IP 192.30.253.112.443 > 192.168.1.10.34260: Flags [.], seq 21143:22543, ack 1580, win 32, options [nop,nop,TS val 2696466745 ecr 6348755], length 1400
22:16:21.882629 IP 192.168.1.10.34260 > 192.30.253.112.443: Flags [.], ack 22543, win 587, options [nop,nop,TS val 6348822 ecr 2696466745], length 0
22:16:21.882641 IP 192.30.253.112.443 > 192.168.1.10.34260: Flags [.], seq 22543:23943, ack 1580, win 32, options [nop,nop,TS val 2696466745 ecr 6348755], length 1400
22:16:21.882652 IP 192.30.253.112.443 > 192.168.1.10.34260: Flags [.], seq 23943:25343, ack 1580, win 32, options [nop,nop,TS val 2696466745 ecr 6348755], length 1400
22:16:21.882661 IP 192.168.1.10.34260 > 192.30.253.112.443: Flags [.], ack 25343, win 631, options [nop,nop,TS val 6348822 ecr 2696466745], length 0
22:16:21.882672 IP 192.30.253.112.443 > 192.168.1.10.34260: Flags [.], seq 25343:26743, ack 1580, win 32, options [nop,nop,TS val 2696466745 ecr 6348755], length 1400
22:16:21.882686 IP 192.30.253.112.443 > 192.168.1.10.34260: Flags [.], seq 26743:28143, ack 1580, win 32, options [nop,nop,TS val 2696466745 ecr 6348755], length 1400
22:16:21.882695 IP 192.168.1.10.34260 > 192.30.253.112.443: Flags [.], ack 28143, win 674, options [nop,nop,TS val 6348822 ecr 2696466745], length 0
22:16:21.927869 IP 192.30.253.112.443 > 192.168.1.10.34264: Flags [S.], seq 3743278326, ack 499481798, win 28480, options [mss 1412,sackOK,TS val 2696466757 ecr 6348548,nop,wscale 10], length 0
22:16:21.927919 IP 192.168.1.10.34264 > 192.30.253.112.443: Flags [.], ack 1, win 229, options [nop,nop,TS val 6348834 ecr 2696466470], length 0
22:16:22.148278 IP 192.30.253.112.443 > 192.168.1.10.34260: Flags [.], seq 28143:29543, ack 1580, win 32, options [nop,nop,TS val 2696466812 ecr 6348822], length 1400
22:16:22.149364 IP 192.30.253.112.443 > 192.168.1.10.34260: Flags [.], seq 29543:30943, ack 1580, win 32, options [nop,nop,TS val 2696466812 ecr 6348822], length 1400
22:16:22.149394 IP 192.168.1.10.34260 > 192.30.253.112.443: Flags [.], ack 30943, win 718, options [nop,nop,TS val 6348889 ecr 2696466812], length 0
22:16:22.149425 IP 192.30.253.112.443 > 192.168.1.10.34260: Flags [.], seq 30943:32343, ack 1580, win 32, options [nop,nop,TS val 2696466812 ecr 6348822], length 1400
22:16:22.149439 IP 192.30.253.112.443 > 192.168.1.10.34260: Flags [.], seq 32343:33743, ack 1580, win 32, options [nop,nop,TS val 2696466812 ecr 6348822], length 1400
22:16:22.149448 IP 192.168.1.10.34260 > 192.30.253.112.443: Flags [.], ack 33743, win 762, options [nop,nop,TS val 6348889 ecr 2696466812], length 0
22:16:22.151841 IP 192.30.253.112.443 > 192.168.1.10.34260: Flags [.], seq 33743:35143, ack 1580, win 32, options [nop,nop,TS val 2696466812 ecr 6348822], length 1400
22:16:22.151883 IP 192.30.253.112.443 > 192.168.1.10.34260: Flags [.], seq 35143:36543, ack 1580, win 32, options [nop,nop,TS val 2696466812 ecr 6348822], length 1400
22:16:22.151905 IP 192.168.1.10.34260 > 192.30.253.112.443: Flags [.], ack 36543, win 806, options [nop,nop,TS val 6348890 ecr 2696466812], length 0
22:16:22.151927 IP 192.30.253.112.443 > 192.168.1.10.34260: Flags [.], seq 36543:37943, ack 1580, win 32, options [nop,nop,TS val 2696466812 ecr 6348822], length 1400
22:16:22.151949 IP 192.30.253.112.443 > 192.168.1.10.34260: Flags [.], seq 37943:39343, ack 1580, win 32, options [nop,nop,TS val 2696466812 ecr 6348822], length 1400
22:16:22.151956 IP 192.168.1.10.34260 > 192.30.253.112.443: Flags [.], ack 39343, win 849, options [nop,nop,TS val 6348890 ecr 2696466812], length 0
22:16:22.151965 IP 192.30.253.112.443 > 192.168.1.10.34260: Flags [.], seq 39343:40743, ack 1580, win 32, options [nop,nop,TS val 2696466812 ecr 6348822], length 1400
22:16:22.151970 IP 192.30.253.112.443 > 192.168.1.10.34260: Flags [.], seq 40743:42143, ack 1580, win 32, options [nop,nop,TS val 2696466812 ecr 6348822], length 1400
22:16:22.151991 IP 192.168.1.10.34260 > 192.30.253.112.443: Flags [.], ack 42143, win 893, options [nop,nop,TS val 6348890 ecr 2696466812], length 0
22:16:22.414515 IP 192.30.253.112.443 > 192.168.1.10.34260: Flags [.], seq 42143:43543, ack 1580, win 32, options [nop,nop,TS val 2696466879 ecr 6348889], length 1400
22:16:22.415582 IP 192.30.253.112.443 > 192.168.1.10.34260: Flags [.], seq 43543:44943, ack 1580, win 32, options [nop,nop,TS val 2696466879 ecr 6348889], length 1400
22:16:22.415605 IP 192.168.1.10.34260 > 192.30.253.112.443: Flags [.], ack 44943, win 937, options [nop,nop,TS val 6348956 ecr 2696466879], length 0
22:16:22.415624 IP 192.30.253.112.443 > 192.168.1.10.34260: Flags [.], seq 44943:46343, ack 1580, win 32, options [nop,nop,TS val 2696466879 ecr 6348889], length 1400
22:16:22.415634 IP 192.30.253.112.443 > 192.168.1.10.34260: Flags [.], seq 46343:47743, ack 1580, win 32, options [nop,nop,TS val 2696466879 ecr 6348889], length 1400
22:16:22.415644 IP 192.168.1.10.34260 > 192.30.253.112.443: Flags [.], ack 47743, win 981, options [nop,nop,TS val 6348956 ecr 2696466879], length 0
22:16:22.417322 IP 192.30.253.112.443 > 192.168.1.10.34260: Flags [.], seq 47743:49143, ack 1580, win 32, options [nop,nop,TS val 2696466879 ecr 6348890], length 1400
22:16:22.418849 IP 192.30.253.112.443 > 192.168.1.10.34260: Flags [.], seq 49143:50543, ack 1580, win 32, options [nop,nop,TS val 2696466879 ecr 6348890], length 1400
22:16:22.418904 IP 192.168.1.10.34260 > 192.30.253.112.443: Flags [.], ack 50543, win 1024, options [nop,nop,TS val 6348956 ecr 2696466879], length 0
22:16:22.418932 IP 192.30.253.112.443 > 192.168.1.10.34260: Flags [.], seq 50543:51943, ack 1580, win 32, options [nop,nop,TS val 2696466879 ecr 6348890], length 1400
22:16:22.418952 IP 192.30.253.112.443 > 192.168.1.10.34260: Flags [.], seq 51943:53343, ack 1580, win 32, options [nop,nop,TS val 2696466879 ecr 6348890], length 1400
22:16:22.418963 IP 192.168.1.10.34260 > 192.30.253.112.443: Flags [.], ack 53343, win 1068, options [nop,nop,TS val 6348956 ecr 2696466879], length 0
22:16:22.418974 IP 192.30.253.112.443 > 192.168.1.10.34260: Flags [.], seq 53343:54743, ack 1580, win 32, options [nop,nop,TS val 2696466879 ecr 6348890], length 1400
22:16:22.419001 IP 192.30.253.112.443 > 192.168.1.10.34260: Flags [.], seq 54743:56143, ack 1580, win 32, options [nop,nop,TS val 2696466879 ecr 6348890], length 1400
22:16:22.419014 IP 192.168.1.10.34260 > 192.30.253.112.443: Flags [.], ack 56143, win 1112, options [nop,nop,TS val 6348956 ecr 2696466879], length 0
22:16:22.681328 IP 192.30.253.112.443 > 192.168.1.10.34260: Flags [.], seq 56143:57543, ack 1580, win 32, options [nop,nop,TS val 2696466945 ecr 6348956], length 1400
22:16:22.682249 IP 192.30.253.112.443 > 192.168.1.10.34260: Flags [.], seq 57543:58943, ack 1580, win 32, options [nop,nop,TS val 2696466945 ecr 6348956], length 1400
22:16:22.682274 IP 192.168.1.10.34260 > 192.30.253.112.443: Flags [.], ack 58943, win 1156, options [nop,nop,TS val 6349022 ecr 2696466945], length 0
22:16:22.682288 IP 192.30.253.112.443 > 192.168.1.10.34260: Flags [.], seq 58943:60343, ack 1580, win 32, options [nop,nop,TS val 2696466945 ecr 6348956], length 1400
22:16:22.682295 IP 192.30.253.112.443 > 192.168.1.10.34260: Flags [.], seq 60343:61743, ack 1580, win 32, options [nop,nop,TS val 2696466945 ecr 6348956], length 1400
22:16:22.682304 IP 192.168.1.10.34260 > 192.30.253.112.443: Flags [.], ack 61743, win 1199, options [nop,nop,TS val 6349022 ecr 2696466945], length 0
22:16:22.701828 IP 192.30.253.112.443 > 192.168.1.10.34260: Flags [.], seq 61743:63143, ack 1580, win 32, options [nop,nop,TS val 2696466950 ecr 6348956], length 1400
22:16:22.702515 IP 192.30.253.112.443 > 192.168.1.10.34260: Flags [P.], seq 63143:64543, ack 1580, win 32, options [nop,nop,TS val 2696466950 ecr 6348956], length 1400
22:16:22.702529 IP 192.168.1.10.34260 > 192.30.253.112.443: Flags [.], ack 64543, win 1243, options [nop,nop,TS val 6349027 ecr 2696466950], length 0
22:16:22.702542 IP 192.30.253.112.443 > 192.168.1.10.34260: Flags [P.], seq 64543:65013, ack 1580, win 32, options [nop,nop,TS val 2696466950 ecr 6348956], length 470
22:16:22.739569 IP 192.168.1.10.34260 > 192.30.253.112.443: Flags [.], ack 65013, win 1265, options [nop,nop,TS val 6349037 ecr 2696466950], length 0
22:16:23.187236 IP 192.168.1.10.57184 > 52.45.72.236.443: Flags [.], seq 3884899986:3884901386, ack 3494581544, win 318, options [nop,nop,TS val 6349148 ecr 5873129], length 1400
22:16:23.190095 IP 192.168.1.10.57184 > 52.45.72.236.443: Flags [P.], seq 1400:1840, ack 1, win 318, options [nop,nop,TS val 6349149 ecr 5873129], length 440
22:16:23.192650 IP 192.168.1.10.38015 > 103.28.94.230.443: UDP, length 1350
22:16:23.193140 IP 192.168.1.10.38015 > 103.28.94.230.443: UDP, length 305
22:16:23.193197 IP 192.168.1.10.38015 > 103.28.94.230.443: UDP, length 368
22:16:23.247816 IP 103.28.94.230.443 > 192.168.1.10.38015: UDP, length 1350
22:16:23.249403 IP 192.168.1.10.38015 > 103.28.94.230.443: UDP, length 301
22:16:23.275125 IP 192.168.1.10.38015 > 103.28.94.230.443: UDP, length 37
22:16:23.296213 IP 103.28.94.230.443 > 192.168.1.10.38015: UDP, length 40
22:16:23.296589 IP 103.28.94.230.443 > 192.168.1.10.38015: UDP, length 40
22:16:23.296605 IP 103.28.94.230.443 > 192.168.1.10.38015: UDP, length 37
22:16:23.297029 IP 192.168.1.10.38015 > 103.28.94.230.443: UDP, length 364
22:16:23.297038 IP 103.28.94.230.443 > 192.168.1.10.38015: UDP, length 317
22:16:23.324013 IP 192.168.1.10.38015 > 103.28.94.230.443: UDP, length 46
22:16:23.372097 IP 103.28.94.230.443 > 192.168.1.10.38015: UDP, length 43
22:16:23.471018 IP 52.45.72.236.443 > 192.168.1.10.57184: Flags [.], ack 1840, win 166, options [nop,nop,TS val 5881203 ecr 6349148], length 0
22:16:23.481905 IP 52.45.72.236.443 > 192.168.1.10.57184: Flags [P.], seq 1:575, ack 1840, win 166, options [nop,nop,TS val 5881206 ecr 6349148], length 574
22:16:23.481947 IP 192.168.1.10.57184 > 52.45.72.236.443: Flags [.], ack 575, win 327, options [nop,nop,TS val 6349222 ecr 5881206], length 0
22:16:23.482427 ARP, Request who-has 192.168.1.10 tell 192.168.1.1, length 28
22:16:23.482440 ARP, Reply 192.168.1.10 is-at 08:11:96:a5:65:78, length 28
22:16:23.661336 IP 192.168.1.10.35528 > 192.30.253.116.443: Flags [S], seq 1241731881, win 29200, options [mss 1460,sackOK,TS val 6349267 ecr 0,nop,wscale 7], length 0
22:16:23.912626 IP 192.168.1.10.35530 > 192.30.253.116.443: Flags [S], seq 3145254419, win 29200, options [mss 1460,sackOK,TS val 6349330 ecr 0,nop,wscale 7], length 0
22:16:23.940871 IP 192.30.253.116.443 > 192.168.1.10.35528: Flags [S.], seq 3826426000, ack 1241731882, win 28480, options [mss 1412,sackOK,TS val 2068175759 ecr 6349267,nop,wscale 10], length 0
22:16:23.941002 IP 192.168.1.10.35528 > 192.30.253.116.443: Flags [.], ack 1, win 229, options [nop,nop,TS val 6349337 ecr 2068175759], length 0
22:16:23.941776 IP 192.168.1.10.35528 > 192.30.253.116.443: Flags [P.], seq 1:224, ack 1, win 229, options [nop,nop,TS val 6349337 ecr 2068175759], length 223
22:16:24.182607 IP 192.30.253.116.443 > 192.168.1.10.35530: Flags [S.], seq 1031253239, ack 3145254420, win 28480, options [mss 1412,sackOK,TS val 2068175821 ecr 6349330,nop,wscale 10], length 0
22:16:24.182672 IP 192.168.1.10.35530 > 192.30.253.116.443: Flags [.], ack 1, win 229, options [nop,nop,TS val 6349397 ecr 2068175821], length 0
22:16:24.219826 IP 192.30.253.116.443 > 192.168.1.10.35528: Flags [P.], seq 1:153, ack 224, win 29, options [nop,nop,TS val 2068175829 ecr 6349337], length 152
22:16:24.219903 IP 192.168.1.10.35528 > 192.30.253.116.443: Flags [.], ack 153, win 237, options [nop,nop,TS val 6349407 ecr 2068175829], length 0
22:16:24.220300 IP 192.168.1.10.35528 > 192.30.253.116.443: Flags [P.], seq 224:275, ack 153, win 237, options [nop,nop,TS val 6349407 ecr 2068175829], length 51
22:16:24.221626 IP 192.168.1.10.35528 > 192.30.253.116.443: Flags [.], seq 275:1675, ack 153, win 237, options [nop,nop,TS val 6349407 ecr 2068175829], length 1400
22:16:24.222666 IP 192.168.1.10.35528 > 192.30.253.116.443: Flags [.], seq 1675:3075, ack 153, win 237, options [nop,nop,TS val 6349407 ecr 2068175829], length 1400
22:16:24.222691 IP 192.168.1.10.35528 > 192.30.253.116.443: Flags [.], seq 3075:4475, ack 153, win 237, options [nop,nop,TS val 6349407 ecr 2068175829], length 1400
22:16:24.225723 IP 192.168.1.10.35528 > 192.30.253.116.443: Flags [.], seq 4475:5875, ack 153, win 237, options [nop,nop,TS val 6349408 ecr 2068175829], length 1400
22:16:24.225761 IP 192.168.1.10.35528 > 192.30.253.116.443: Flags [.], seq 5875:7275, ack 153, win 237, options [nop,nop,TS val 6349408 ecr 2068175829], length 1400
22:16:24.229086 IP 192.168.1.10.35528 > 192.30.253.116.443: Flags [.], seq 7275:8675, ack 153, win 237, options [nop,nop,TS val 6349409 ecr 2068175829], length 1400
22:16:24.229116 IP 192.168.1.10.35528 > 192.30.253.116.443: Flags [.], seq 8675:10075, ack 153, win 237, options [nop,nop,TS val 6349409 ecr 2068175829], length 1400
22:16:24.232023 IP 192.168.1.10.35528 > 192.30.253.116.443: Flags [P.], seq 10075:11054, ack 153, win 237, options [nop,nop,TS val 6349410 ecr 2068175829], length 979
22:16:24.500510 IP 192.30.253.116.443 > 192.168.1.10.35528: Flags [.], ack 1675, win 32, options [nop,nop,TS val 2068175899 ecr 6349407], length 0
22:16:24.500918 IP 192.30.253.116.443 > 192.168.1.10.35528: Flags [.], ack 3075, win 35, options [nop,nop,TS val 2068175899 ecr 6349407], length 0
22:16:24.501330 IP 192.30.253.116.443 > 192.168.1.10.35528: Flags [.], ack 4475, win 38, options [nop,nop,TS val 2068175899 ecr 6349407], length 0
22:16:24.508230 IP 192.30.253.116.443 > 192.168.1.10.35528: Flags [.], ack 5875, win 40, options [nop,nop,TS val 2068175900 ecr 6349408], length 0
22:16:24.508531 IP 192.30.253.116.443 > 192.168.1.10.35528: Flags [.], ack 7275, win 43, options [nop,nop,TS val 2068175901 ecr 6349408], length 0
22:16:24.524282 IP 192.30.253.116.443 > 192.168.1.10.35528: Flags [.], ack 8675, win 46, options [nop,nop,TS val 2068175905 ecr 6349409], length 0
22:16:24.524576 IP 192.30.253.116.443 > 192.168.1.10.35528: Flags [.], ack 10075, win 48, options [nop,nop,TS val 2068175905 ecr 6349409], length 0
22:16:24.524838 IP 192.30.253.116.443 > 192.168.1.10.35528: Flags [.], ack 11054, win 51, options [nop,nop,TS val 2068175905 ecr 6349410], length 0
22:16:24.534540 IP 192.30.253.116.443 > 192.168.1.10.35528: Flags [P.], seq 153:940, ack 11054, win 51, options [nop,nop,TS val 2068175907 ecr 6349410], length 787
22:16:24.571613 IP 192.168.1.10.35528 > 192.30.253.116.443: Flags [.], ack 940, win 249, options [nop,nop,TS val 6349495 ecr 2068175907], length 0
22:16:24.604063 IP6 fe80::a959:335:80f7:f6c0.5835 > fe80::1.53: 37348+ A? plus.google.com. (33)
22:16:24.604102 IP 192.168.1.10.16880 > 192.168.1.1.53: 37348+ A? plus.google.com. (33)
22:16:24.608239 IP6 fe80::1.53 > fe80::a959:335:80f7:f6c0.5835: 37348 15/0/0 A 103.28.94.211, A 103.28.94.234, A 103.28.94.245, A 103.28.94.230, A 103.28.94.241, A 103.28.94.237, A 103.28.94.226, A 103.28.94.236, A 103.28.94.215, A 103.28.94.207, A 103.28.94.219, A 103.28.94.249, A 103.28.94.221, A 103.28.94.222, A 103.28.94.251 (273)
22:16:24.609202 IP 192.168.1.10.59084 > 103.28.94.241.443: Flags [P.], seq 1:300, ack 1, win 425, options [nop,nop,TS val 6349504 ecr 662414136], length 299
22:16:24.609906 IP 192.168.1.1.53 > 192.168.1.10.16880: 37348 15/0/0 A 103.28.94.249, A 103.28.94.221, A 103.28.94.222, A 103.28.94.251, A 103.28.94.211, A 103.28.94.234, A 103.28.94.245, A 103.28.94.230, A 103.28.94.241, A 103.28.94.237, A 103.28.94.226, A 103.28.94.236, A 103.28.94.215, A 103.28.94.207, A 103.28.94.219 (273)
22:16:24.609940 IP 192.168.1.10 > 192.168.1.1: ICMP 192.168.1.10 udp port 16880 unreachable, length 309
22:16:24.609961 IP 192.168.1.10.59084 > 103.28.94.241.443: Flags [P.], seq 300:550, ack 1, win 425, options [nop,nop,TS val 6349504 ecr 662414136], length 250
22:16:24.619785 IP 103.28.94.241.443 > 192.168.1.10.59084: Flags [.], ack 300, win 354, options [nop,nop,TS val 662419770 ecr 6349504], length 0
22:16:24.620400 IP 103.28.94.241.443 > 192.168.1.10.59084: Flags [.], ack 550, win 375, options [nop,nop,TS val 662419771 ecr 6349504], length 0
22:16:24.637600 IP 103.28.94.241.443 > 192.168.1.10.59084: Flags [P.], seq 1:47, ack 550, win 375, options [nop,nop,TS val 662419787 ecr 6349504], length 46
22:16:24.675601 IP 192.168.1.10.59084 > 103.28.94.241.443: Flags [.], ack 47, win 425, options [nop,nop,TS val 6349521 ecr 662419787], length 0
22:16:24.833994 IP 103.28.94.241.443 > 192.168.1.10.59084: Flags [P.], seq 47:321, ack 550, win 375, options [nop,nop,TS val 662419982 ecr 6349521], length 274
22:16:24.834055 IP 192.168.1.10.59084 > 103.28.94.241.443: Flags [.], ack 321, win 447, options [nop,nop,TS val 6349560 ecr 662419982], length 0
22:16:24.912028 IP 103.28.94.241.443 > 192.168.1.10.59084: Flags [P.], seq 321:628, ack 550, win 375, options [nop,nop,TS val 662420060 ecr 6349560], length 307
22:16:24.912078 IP 192.168.1.10.59084 > 103.28.94.241.443: Flags [.], ack 628, win 469, options [nop,nop,TS val 6349580 ecr 662420060], length 0
22:16:25.138889 IP 103.28.94.241.443 > 192.168.1.10.59084: Flags [P.], seq 628:838, ack 550, win 375, options [nop,nop,TS val 662420289 ecr 6349580], length 210
22:16:25.138940 IP 192.168.1.10.59084 > 103.28.94.241.443: Flags [.], ack 838, win 491, options [nop,nop,TS val 6349636 ecr 662420289], length 0
22:16:25.139645 IP 192.168.1.10.59084 > 103.28.94.241.443: Flags [P.], seq 550:596, ack 838, win 491, options [nop,nop,TS val 6349637 ecr 662420289], length 46
22:16:25.186553 IP 103.28.94.241.443 > 192.168.1.10.59084: Flags [.], ack 596, win 375, options [nop,nop,TS val 662420340 ecr 6349637], length 0
22:16:25.360768 IP 192.30.253.116.443 > 192.168.1.10.35530: Flags [S.], seq 1031253239, ack 3145254420, win 28480, options [mss 1412,sackOK,TS val 2068176116 ecr 6349397,nop,wscale 10], length 0
22:16:25.360820 IP 192.168.1.10.35530 > 192.30.253.116.443: Flags [.], ack 1, win 229, options [nop,nop,TS val 6349692 ecr 2068175821], length 0
22:16:25.696157 IP 103.28.94.234.443 > 192.168.1.10.53460: Flags [P.], seq 3172258270:3172258333, ack 2499320968, win 252, options [nop,nop,TS val 757826972 ecr 6289775], length 63
22:16:25.696357 IP 103.28.94.234.443 > 192.168.1.10.53460: Flags [F.], seq 63, ack 1, win 252, options [nop,nop,TS val 757826972 ecr 6289775], length 0
22:16:25.696563 IP 192.168.1.10.53460 > 103.28.94.234.443: Flags [F.], seq 1, ack 64, win 360, options [nop,nop,TS val 6349776 ecr 757826972], length 0
22:16:25.702207 IP 103.28.94.234.443 > 192.168.1.10.53460: Flags [.], ack 2, win 252, options [nop,nop,TS val 757826978 ecr 6349776], length 0
22:16:26.911553 IP 192.168.1.10.45518 > 13.76.38.56.443: Flags [.], ack 1006160992, win 382, options [nop,nop,TS val 6350080 ecr 307667616], length 0
22:16:26.911598 IP 192.168.1.10.47992 > 192.229.145.200.443: Flags [.], ack 1413421264, win 405, length 0
22:16:26.920126 IP 192.229.145.200.443 > 192.168.1.10.47992: Flags [.], ack 1, win 290, length 0
22:16:26.934587 IP 13.76.38.56.443 > 192.168.1.10.45518: Flags [.], ack 1, win 514, options [nop,nop,TS val 307672129 ecr 6327558], length 0
22:16:29.615616 IP6 fe80::a959:335:80f7:f6c0 > fe80::1: ICMP6, neighbor solicitation, who has fe80::1, length 32
22:16:29.619759 IP6 fe80::1 > fe80::a959:335:80f7:f6c0: ICMP6, neighbor advertisement, tgt is fe80::1, length 24
22:16:29.983602 IP 192.168.1.10.59050 > 103.28.94.241.443: Flags [.], ack 2013434139, win 246, options [nop,nop,TS val 6350848 ecr 662380088], length 0
22:16:30.023307 IP 103.28.94.241.443 > 192.168.1.10.59050: Flags [.], ack 1, win 245, options [nop,nop,TS val 662425178 ecr 6294525], length 0
22:16:30.826038 IP 74.125.200.189.443 > 192.168.1.10.43986: Flags [P.], seq 842760639:842760700, ack 154613358, win 574, options [nop,nop,TS val 287552762 ecr 6345002], length 61
22:16:30.826109 IP 192.168.1.10.43986 > 74.125.200.189.443: Flags [.], ack 61, win 688, options [nop,nop,TS val 6351058 ecr 287552762], length 0
22:16:31.226674 IP 132.245.254.226.443 > 192.168.1.10.48302: Flags [P.], seq 1641684993:1641685062, ack 904798607, win 12208, length 69
22:16:31.227061 IP 132.245.254.226.443 > 192.168.1.10.48302: Flags [P.], seq 69:186, ack 1, win 12208, length 117
22:16:31.227770 IP 192.168.1.10.48302 > 132.245.254.226.443: Flags [.], ack 186, win 1332, length 0
22:16:31.614485 IP 192.30.253.112.443 > 192.168.1.10.34260: Flags [P.], seq 65013:65044, ack 1580, win 32, options [nop,nop,TS val 2696469179 ecr 6349037], length 31
22:16:31.614543 IP 192.168.1.10.34260 > 192.30.253.112.443: Flags [.], ack 65044, win 1265, options [nop,nop,TS val 6351255 ecr 2696469179], length 0
22:16:31.615167 IP 192.30.253.112.443 > 192.168.1.10.34260: Flags [F.], seq 65044, ack 1580, win 32, options [nop,nop,TS val 2696469179 ecr 6349037], length 0
22:16:31.651586 IP 192.168.1.10.34260 > 192.30.253.112.443: Flags [.], ack 65045, win 1265, options [nop,nop,TS val 6351265 ecr 2696469179], length 0
22:16:33.597388 IP 192.168.1.10.44738 > 158.85.224.178.443: Flags [P.], seq 1706093916:1706093954, ack 1575984910, win 2553, options [nop,nop,TS val 6351751 ecr 2819807106], length 38
22:16:33.862851 IP 158.85.224.178.443 > 192.168.1.10.44738: Flags [P.], seq 1:46, ack 38, win 5, options [nop,nop,TS val 2819827103 ecr 6351751], length 45
22:16:33.862885 IP 192.168.1.10.44738 > 158.85.224.178.443: Flags [.], ack 46, win 2553, options [nop,nop,TS val 6351817 ecr 2819827103], length 0
22:16:34.533858 IP 192.30.253.116.443 > 192.168.1.10.35528: Flags [P.], seq 940:971, ack 11054, win 51, options [nop,nop,TS val 2068178407 ecr 6349495], length 31
22:16:34.533920 IP 192.168.1.10.35528 > 192.30.253.116.443: Flags [.], ack 971, win 249, options [nop,nop,TS val 6351985 ecr 2068178407], length 0
22:16:34.534228 IP 192.30.253.116.443 > 192.168.1.10.35528: Flags [F.], seq 971, ack 11054, win 51, options [nop,nop,TS val 2068178407 ecr 6349495], length 0
22:16:34.571545 IP 192.168.1.10.35528 > 192.30.253.116.443: Flags [.], ack 972, win 249, options [nop,nop,TS val 6351995 ecr 2068178407], length 0
22:16:36.070882 IP 192.30.253.112.443 > 192.168.1.10.34262: Flags [P.], seq 153:184, ack 283, win 29, options [nop,nop,TS val 2696470293 ecr 6348552], length 31
22:16:36.071233 IP 192.30.253.112.443 > 192.168.1.10.34262: Flags [F.], seq 184, ack 283, win 29, options [nop,nop,TS val 2696470293 ecr 6348552], length 0
22:16:36.107567 IP 192.168.1.10.34262 > 192.30.253.112.443: Flags [.], ack 185, win 237, options [nop,nop,TS val 6352379 ecr 2696470293], length 0
22:16:36.383550 IP 192.168.1.10.45058 > 151.101.100.133.443: Flags [.], ack 3322701141, win 245, options [nop,nop,TS val 6352448 ecr 2952524348], length 0
22:16:36.404289 IP 151.101.100.133.443 > 192.168.1.10.45058: Flags [.], ack 1, win 61, options [nop,nop,TS val 2952535615 ecr 6341196], length 0
22:16:36.887576 IP 192.168.1.10.45054 > 151.101.100.133.443: Flags [.], ack 2772426174, win 254, options [nop,nop,TS val 6352574 ecr 2889779237], length 0
22:16:36.908249 IP 151.101.100.133.443 > 192.168.1.10.45054: Flags [.], ack 1, win 64, options [nop,nop,TS val 2889790492 ecr 6341324], length 0
22:16:36.931564 IP 192.168.1.10.45062 > 151.101.100.133.443: Flags [.], ack 3283330281, win 245, options [nop,nop,TS val 6352585 ecr 1612783421], length 0
22:16:36.954613 IP 151.101.100.133.443 > 192.168.1.10.45062: Flags [.], ack 1, win 61, options [nop,nop,TS val 1612794675 ecr 6341345], length 0
22:16:36.955550 IP 192.168.1.10.45060 > 151.101.100.133.443: Flags [.], ack 1154696529, win 245, options [nop,nop,TS val 6352591 ecr 1094336206], length 0
22:16:36.978568 IP 151.101.100.133.443 > 192.168.1.10.45060: Flags [.], ack 1, win 61, options [nop,nop,TS val 1094347462 ecr 6341351], length 0
22:16:37.021088 IP 74.125.130.189.443 > 192.168.1.10.38082: Flags [P.], seq 2357874159:2357874220, ack 606349022, win 579, options [nop,nop,TS val 2102777791 ecr 6345766], length 61
22:16:37.059538 IP 192.168.1.10.38082 > 74.125.130.189.443: Flags [.], ack 61, win 622, options [nop,nop,TS val 6352617 ecr 2102777791], length 0
22:16:37.063565 IP 192.168.1.10.45064 > 151.101.100.133.443: Flags [.], ack 3525436956, win 245, options [nop,nop,TS val 6352618 ecr 2889779281], length 0
22:16:37.084741 IP 151.101.100.133.443 > 192.168.1.10.45064: Flags [.], ack 1, win 61, options [nop,nop,TS val 2889790536 ecr 6341378], length 0
22:16:37.939600 IP 192.168.1.10.45056 > 151.101.100.133.443: Flags [.], ack 2400332764, win 262, options [nop,nop,TS val 6352837 ecr 1612783671], length 0
22:16:37.965233 IP 151.101.100.133.443 > 192.168.1.10.45056: Flags [.], ack 1, win 66, options [nop,nop,TS val 1612794928 ecr 6341586], length 0
22:16:38.211565 IP 192.168.1.10.45066 > 151.101.100.133.443: Flags [.], ack 1454724172, win 254, options [nop,nop,TS val 6352905 ecr 1612783738], length 0
22:16:38.236220 IP 151.101.100.133.443 > 192.168.1.10.45066: Flags [.], ack 1, win 64, options [nop,nop,TS val 1612794995 ecr 6341654], length 0
22:16:38.576180 IP 74.125.130.189.443 > 192.168.1.10.38086: Flags [P.], seq 3407531157:3407531218, ack 755630162, win 555, options [nop,nop,TS val 1499449636 ecr 6346130], length 61
22:16:38.576236 IP 192.168.1.10.38086 > 74.125.130.189.443: Flags [.], ack 61, win 425, options [nop,nop,TS val 6352996 ecr 1499449636], length 0
22:16:39.310823 IP 64.4.45.13.443 > 192.168.1.10.50184: Flags [P.], seq 3729472010:3729472543, ack 1878070405, win 607, options [nop,nop,TS val 3485994992 ecr 6343753], length 533
22:16:39.310897 IP 192.168.1.10.50184 > 64.4.45.13.443: Flags [.], ack 533, win 1318, options [nop,nop,TS val 6353179 ecr 3485994992], length 0
22:16:39.655719 IP6 fe80::a959:335:80f7:f6c0.51327 > fe80::1.53: 62839+ A? plus.google.com. (33)
22:16:39.658777 IP6 fe80::1.53 > fe80::a959:335:80f7:f6c0.51327: 62839 15/0/0 A 103.28.94.251, A 103.28.94.211, A 103.28.94.234, A 103.28.94.245, A 103.28.94.230, A 103.28.94.241, A 103.28.94.237, A 103.28.94.226, A 103.28.94.236, A 103.28.94.215, A 103.28.94.207, A 103.28.94.219, A 103.28.94.249, A 103.28.94.221, A 103.28.94.222 (273)
22:16:39.670767 IP 192.168.1.10.52586 > 103.28.94.251.443: UDP, length 1350
22:16:39.671129 IP 192.168.1.10.52586 > 103.28.94.251.443: UDP, length 808
22:16:39.671176 IP 192.168.1.10.52586 > 103.28.94.251.443: UDP, length 196
22:16:39.704697 IP 192.168.1.10.35528 > 192.30.253.116.443: Flags [F.], seq 11054, ack 972, win 249, options [nop,nop,TS val 6353278 ecr 2068178407], length 0
22:16:39.704794 IP 192.168.1.10.34262 > 192.30.253.112.443: Flags [R.], seq 283, ack 185, win 237, options [nop,nop,TS val 6353278 ecr 2696470293], length 0
22:16:39.704842 IP 192.168.1.10.34260 > 192.30.253.112.443: Flags [F.], seq 1580, ack 65045, win 1265, options [nop,nop,TS val 6353278 ecr 2696469179], length 0
22:16:39.704945 IP 192.168.1.10.35530 > 192.30.253.116.443: Flags [F.], seq 1, ack 1, win 229, options [nop,nop,TS val 6353278 ecr 2068175821], length 0
22:16:39.704965 IP 192.168.1.10.34264 > 192.30.253.112.443: Flags [F.], seq 1, ack 1, win 229, options [nop,nop,TS val 6353278 ecr 2696466470], length 0
22:16:39.705081 IP 192.168.1.10.55926 > 103.28.94.251.443: Flags [S], seq 302103587, win 29200, options [mss 1460,sackOK,TS val 6353278 ecr 0,nop,wscale 7], length 0
22:16:39.711593 IP 192.168.1.10.36422 > 74.125.130.94.443: Flags [.], ack 1431248272, win 237, options [nop,nop,TS val 6353280 ecr 470425133], length 0
22:16:39.713829 IP 103.28.94.251.443 > 192.168.1.10.55926: Flags [S.], seq 353260467, ack 302103588, win 28960, options [mss 1412,sackOK,TS val 662434866 ecr 6353278,nop,wscale 7], length 0
22:16:39.713883 IP 192.168.1.10.55926 > 103.28.94.251.443: Flags [.], ack 1, win 229, options [nop,nop,TS val 6353280 ecr 662434866], length 0
22:16:39.714240 IP 192.168.1.10.55926 > 103.28.94.251.443: Flags [P.], seq 1:518, ack 1, win 229, options [nop,nop,TS val 6353280 ecr 662434866], length 517
22:16:39.719649 IP 192.168.1.10.52586 > 103.28.94.251.443: UDP, length 1350
22:16:39.722259 IP 103.28.94.251.443 > 192.168.1.10.55926: Flags [.], ack 518, win 235, options [nop,nop,TS val 662434875 ecr 6353280], length 0
22:16:39.734783 IP 74.125.130.94.443 > 192.168.1.10.36422: Flags [.], ack 1, win 349, options [nop,nop,TS val 470470188 ecr 6308195], length 0
22:16:39.740591 IP 103.28.94.251.443 > 192.168.1.10.55926: Flags [P.], seq 1:161, ack 518, win 235, options [nop,nop,TS val 662434892 ecr 6353280], length 160
22:16:39.740622 IP 192.168.1.10.55926 > 103.28.94.251.443: Flags [.], ack 161, win 237, options [nop,nop,TS val 6353287 ecr 662434892], length 0
22:16:39.743034 IP 192.168.1.10.55926 > 103.28.94.251.443: Flags [P.], seq 518:734, ack 161, win 237, options [nop,nop,TS val 6353287 ecr 662434892], length 216
22:16:39.748613 IP 192.168.1.10.55926 > 103.28.94.251.443: Flags [P.], seq 734:787, ack 161, win 237, options [nop,nop,TS val 6353289 ecr 662434892], length 53
22:16:39.751532 IP 192.168.1.10.55926 > 103.28.94.251.443: Flags [P.], seq 787:879, ack 161, win 237, options [nop,nop,TS val 6353290 ecr 662434892], length 92
22:16:39.751701 IP 103.28.94.251.443 > 192.168.1.10.52586: UDP, length 1350
22:16:39.753023 IP 192.168.1.10.52586 > 103.28.94.251.443: UDP, length 804
22:16:39.758045 IP 103.28.94.251.443 > 192.168.1.10.55926: Flags [.], ack 787, win 243, options [nop,nop,TS val 662434909 ecr 6353287], length 0
22:16:39.778301 IP 192.168.1.10.52586 > 103.28.94.251.443: UDP, length 37
22:16:39.779430 IP 103.28.94.251.443 > 192.168.1.10.55926: Flags [P.], seq 161:223, ack 879, win 243, options [nop,nop,TS val 662434920 ecr 6353290], length 62
22:16:39.779751 IP 103.28.94.251.443 > 192.168.1.10.55926: Flags [P.], seq 223:265, ack 879, win 243, options [nop,nop,TS val 662434920 ecr 6353290], length 42
22:16:39.779762 IP 103.28.94.251.443 > 192.168.1.10.55926: Flags [P.], seq 265:303, ack 879, win 243, options [nop,nop,TS val 662434929 ecr 6353290], length 38
22:16:39.779768 IP 192.168.1.10.55926 > 103.28.94.251.443: Flags [P.], seq 879:917, ack 223, win 237, options [nop,nop,TS val 6353297 ecr 662434920], length 38
22:16:39.779816 IP 192.168.1.10.55926 > 103.28.94.251.443: Flags [.], ack 303, win 237, options [nop,nop,TS val 6353297 ecr 662434920], length 0
22:16:39.784288 IP 103.28.94.251.443 > 192.168.1.10.52586: UDP, length 40
22:16:39.784623 IP 103.28.94.251.443 > 192.168.1.10.52586: UDP, length 40
22:16:39.784641 IP 103.28.94.251.443 > 192.168.1.10.52586: UDP, length 40
22:16:39.784655 IP 192.168.1.10.52586 > 103.28.94.251.443: UDP, length 192
22:16:39.799225 IP 103.28.94.251.443 > 192.168.1.10.52586: UDP, length 1350
22:16:39.825375 IP 192.168.1.10.52586 > 103.28.94.251.443: UDP, length 46
22:16:39.826701 IP 103.28.94.251.443 > 192.168.1.10.55926: Flags [.], ack 917, win 243, options [nop,nop,TS val 662434981 ecr 6353297], length 0
22:16:39.830019 IP 103.28.94.251.443 > 192.168.1.10.52586: UDP, length 43
22:16:39.970447 IP 192.30.253.112.443 > 192.168.1.10.34260: Flags [.], ack 1581, win 32, options [nop,nop,TS val 2696471267 ecr 6353278], length 0
22:16:39.970849 IP 103.28.94.251.443 > 192.168.1.10.52586: UDP, length 394
22:16:39.977220 IP 192.30.253.116.443 > 192.168.1.10.35530: Flags [F.], seq 1, ack 2, win 28, options [nop,nop,TS val 2068179769 ecr 6353278], length 0
22:16:39.977277 IP 192.168.1.10.35530 > 192.30.253.116.443: Flags [.], ack 2, win 229, options [nop,nop,TS val 6353346 ecr 2068179769], length 0
22:16:39.979676 IP 192.30.253.112.443 > 192.168.1.10.34264: Flags [F.], seq 1, ack 2, win 28, options [nop,nop,TS val 2696471270 ecr 6353278], length 0
22:16:39.979702 IP 192.168.1.10.34264 > 192.30.253.112.443: Flags [.], ack 2, win 229, options [nop,nop,TS val 6353347 ecr 2696471270], length 0
22:16:39.986538 IP 192.30.253.116.443 > 192.168.1.10.35528: Flags [.], ack 11055, win 51, options [nop,nop,TS val 2068179770 ecr 6353278], length 0
22:16:39.997314 IP 192.168.1.10.52586 > 103.28.94.251.443: UDP, length 40
22:16:40.182633 IP 103.28.94.251.443 > 192.168.1.10.52586: UDP, length 129
22:16:40.183943 IP 103.28.94.251.443 > 192.168.1.10.52586: UDP, length 37
22:16:40.184223 IP 192.168.1.10.52586 > 103.28.94.251.443: UDP, length 40
22:16:40.607526 IP 192.168.1.10.60326 > 74.125.130.18.443: Flags [.], ack 633271798, win 263, options [nop,nop,TS val 6353504 ecr 2088339681], length 